,Title,Author,ReviewID,Texts,YMD,Sentiment
65796,THE WORST,Anna Belle,R3Y83BAHLSXIW,I RECEIVED A USED PHONE THE PHONE IS FREEZING RIGHT OUT OF THE BOX! THE CHARGER IS AN OLD ONE THE HEADSET IS NOT A BLACKBERRY HEADSET!!!!!!!,3/17/14,0
35286,TOO SMALL!,Charlon L. Gibbs,R2NF2WRH5CCGPV,The phone is way too small and has a really old operating system.  I definitely will be finding a replacement or just reactivating my old phone.  Very disappointed.,3/13/14,0
183271,phone added picture after i buy it it is not a Quad Core  it is duel core,jojo,R22AIQUE2YJDRH,you can buy this phone on ebay  there is a few different  one for 139.00$ and another for 84.00$ go there and buy this phone this person is buying off there and selling it on here for moreAndroid 4.2 Dual SIM Mtk6582 Quad Core Mp4 Wifi GPS Cell Phone N8000 GSM 3g Free Tether Wifi GPS At&t; T-mobile No Contract Phone black,3/9/14,0
153319,DONT WASTE YOUR MONEY!,Dreshauna B.,RFSBHCKB0BUWO,"**DON'T buy this phone! It sucks ! The service goes in and out too much. The camera shows up green. The camera quality is HORRIBLE! It don't have a lot of space, even if you put a memory card in it. The phone freezes up too much, If you use it with Straight Talk it wont be a 2g or even 3g phone. You cant find a case that fits it. The phone is worth NOTHING ! I wouldn't recommend this phone to anybody.",3/2/14,0
88641,htc,andrew bomze,R2E29V38M0G78Y,the camrea does not work and it does not recive text messages sometimes the phone freezes often and is just not good,3/5/14,0
85969,no good pice of crap not for me,james t.,R3LW0ZSZRRI1DX,wish it had never been ordered.  cheep non-conforming peace of garbage that is way overpriced not for me.  can i return it?,3/17/14,0
150803,Not A Very good phone.0 stars,Robert C.,RL7ES0W1LXJQS,Phone Somehow Cracked inside a pouch on my hip.cant use the phone because its inside the glass.wont allow you to turn phone on.theres no warranty on defective phone.am required to pay cost of $80. including shipping to repair.no i do not recommend this phone.no warranty on item.,3/3/14,0
155240,already dead..,jimmy,R2W9H12Q6HD8MG,Just got the phone for a month and now it wont turn on it was fully charge until I turn it off....,3/31/14,0
67611,HTC REVIEW,hunteman,R3V5PUDT2JE0H,"Unfortunately I cannot review the device thoroughly because I haven't been able to use it. I do not reside in the US, so when I ordered it if I'm not mistaken it was advertised as unlocked. However it is locked to Verizon and I can't use my carrier's sim card in it.",3/10/14,0
181274,"horrible phone don't waste your, money",john,R2TBZCPV576J4H,The phone was absolutely horrible the texting was extremely show the internet took 10 plus minutes to load a single Web page the camera is only a 3.0 megapixel camera...the phone looks very nice but that's the only nice thing about the phone,3/25/14,0
164465,Horrible,malia,R19MNK0DN496VR,"This phone is not good. It does not get very good service, cannot send or receive picture messages. Freezes on a regular basis. No space at all.",3/16/14,0
136960,I had 2 phones and both had issues,Shavonda,R2E03V13WP623V,"The phone actually came sooner than the expected date by at least a week. I was so excited about it. The first phone's camera flash and flashlight app didn't work properly or at all at times. I emailed the seller and she emailed me promptly within 24 hours. I had recently transferred my number and service and really needed a phone. I asked the seller if she would send me another phone since it takes so long to receive it in the mail and once I received the new one, I would send back the defected one. She agreed and did just that. When I received the second one, it seemed perfect! Everything on it worked properly...at least the flash did. First of all, I went to a relative's funeral and took pictures of family members that I hadn't seen in a while and when I later went to retrieve the pictures, none of them were saved to the phone nor my sd card. That was very upsetting. Besides that, when I would receive a call, the phone would completely power off and immediately back on several times within a single call. Even in the middle of the night when I would charge it, it would power off and never come on unless I take the battery out then power it on. However, when I contacted the seller once more about the issues with both phones, she offered a full refund once I return the 2 phones...which was a great thing on the seller's part. I really liked the style and size of the phone but the experience was disappointing, especially the second time around...Guess that's what happens when you try to get a $600 Samsung look alike for only $200.",3/29/14,0
66102,Bought in july-2012,smart man,R27V29GF39DMQ0,"This  product does not last for long duration, within 1.5 years this product stopped working, though  it was used in good manner.Better not to choose this stuff.",3/6/14,0
4535,TERRIBLE PHONE,LAWRENCE  IRA  PLESKOW,R15GBRQCF6DWAS,Phone was a ripoff.  I am very upset.  It did not work in Tmobile.  I want my money back to me.,3/27/14,0
150666,I got the phone late... and it was BROKEN!,Rudrani Gollapudi,R3P983KS7XJKXV,"I received this phone late because my school's mail room had lost the package. When I got it, the box was beaten up and the phone was floating around without any padding or bubble tape. When I turned the phone on yesterday, only the left side of the screen worked-- the rest was just a white blur. What am I supposed to do with this??Can I have a refund?",3/3/14,0
103881,worst shipping service ever dont buy here,Fernanda Aguilera,R3AZRX0BX094NL,"I got this phone ( the second one i buy in one month) my other phone was stolen at work, so i order this one and pay for express shipment, because smart phone is very usefull in the day to day work and social ativities, and i want to get it ASAP.  One week later after waiting for the phone i contact the supplier and ask him where is my phone,  He replies ohhh we dont have the color that you choose, do you want the other color to what i said yes. took another 3 days to ship my phone. and was ship by normal mail not by express like requested and paid. So i woulnt recomend this supplier to any one. also advertised as New Unlocked phone, but you get a AT&T; phone not new yes but weird that you get a phone from a phone company.daniel",3/16/14,0
137994,i need the right sim card,lc1345,R21SZCC476HN19,the sim card you sent me was not the right one and is saying it is activated on another device,3/1/14,0
102873,Sucks,amy kolodge,R1V6W8HSG2XY22,Eats threw Minutes like nothing. would not recommend this phone to anyone. Cant connect to Wifi. cheaper and better getting a go phone.,3/7/14,0
155924,HORRIBLE,T Gilham,R1A1WL8OILJ3RS,"Not only did i have to wait a long time for the product it has already malfunctioned. Out of no where the screen stopped working ... I really want my money back but luckily i can still talk on it, at least.",3/14/14,0
164827,this,Amazon Customer,R1OAGNEB11412Z,I bought this phone it don't even work its a waist of money don't do it. don't do it  don't do it,3/25/14,0
167571,This is the worst item that i received fro amazon,hailemeskel tessema,R2HCE2KHVKHBFJ,"I am ashamed for the sellers to receive the amount that i paid for it.by no means i need my money back.It is nothing but simple cheap cell phone.none of the keys on the screen are responding.I bought an 8 gb memory card for it,it did not workin a simple language let me know how we can solve the problem?  Thank you  Tessema",3/6/14,0
162225,Bad decision Sony Xperia Z1,Mariela Varela Campos,R29DVQC4UBZLTE,"I bought this phone with illusion three months ago, but has been disappointing, the second month suffered from sudden death and then had water filtration (a submersible mobile?!). It has been my worst purchase.",3/23/14,0
145377,"Nice phone, but poor quality and even poorer customer service.",Jen,R2W8E950H1CVB3,"Let me make myself clear: initially, this phone is fantastic.  The screen is big and easy to read; I had no issues with any sensitivity on the phone, and the phone itself came with a ton of accessories (phone case, charger, wall charger, headphones, etc).  However, the appearance of the phone does not excuse the quality of the hardware's performance.  I got my phone in November, shortly before Thanksgiving, and by Christmas, it had stopped charging unless I positioned the charger a certain way. (I was NEVER rough with my phone.) By the end of January, it had stopped charging altogether. Because it comes with a warranty, I was able to send it in. I sent it through express mail on the 11th of February and only just today, March 28th, received it back - thanks, I'm sure, to the fact that I sent an aggravated e-mail. The customer service is downright awful.  There was no communication whatsoever on the status of my phone and, even when they finally e-mailed me back on the 20th to ask me if they could replace my phone (it took a MONTH for them to decide they were going to replace it, by the way - a month!), they didn't answer me back until I sent an e-mail a week after asking if they were going to replace it or not.  I've just received my replacement and not only is the phone dirty - the screen has smudges and fingerprints all over it, and the case it literally caked with grime - but there are dents and nicks all over it. Seriously? I cannot be more disappointed with BLU than I am right now, especially since the phone seemed so promising.",3/28/14,0
43780,phone terrible,chanda,RPHRSBZOCJLXD,No... when trying to activate the phone it was reported lost/stolen so I couldn't use the phone plus waited a week and half to get it,3/24/14,0
153385,very poor,shawna talamantes,RHNHWDXMVB5GW,this product came to me with a virus and chinese porn on it and then when i contacted amazon about this they expected me to pay shipping back to china not even knowing if they would fix it or not. Bottom line is that I am out at least 75.00 and my child was out of a christmas gift.,3/19/14,0
179961,"horrible phone don't waste your, money",john,R2TBZCPV576J4H,The phone was absolutely horrible the texting was extremely show the internet took 10 plus minutes to load a single Web page the camera is only a 3.0 megapixel camera...the phone looks very nice but that's the only nice thing about the phone,3/25/14,0
141382,Sim Card is used,richard vasquez,R1N2GLL75FRCDT,Phone seems good but I called T-Mobile costumer service to activate it and they said the sim card was used. Dont  know why. Packaging was new,3/22/14,0
147583,Don't Do it!!,Dacia S. Ewing,R3UI2BUHUMTAF0,"This is the worse phone I have ever purchased in my life. I have had the phone for over 6 months and if I could return it to get my money back or exchange it for something else I would do it in a heartbeat. The sound quality is bad. The phone shuts off on its own. The battery isn't worth two dead flies. It stopped reading my memory card, so I can't play any of my music or save photos to the SD card. When I tell you to run away from this thing I mean it. Don't put yourself through the irritation that is this phone. ANYTHING is better than this.",3/24/14,0
82886,purchase of New Samsung Galazy S Captivate,Toni,R27O9RIVBWPQP7,"I purchased on amazon.com what was suppose to be a New Samsung Galaxy S Captivate. when i received the phone it had bad blemishes and the entire rubber door covering the charging port was missing. There was NOTHING NEW about this phone.  I feel that the description and price online is misleading to munipulate me, the customer into a purchase.",3/21/14,0
156415,Used,Jay Choi,RPZWYG9L0G605,"It says in the description that the product is new. It isn't. The package was opened before, and the original owners or the sellers put their own tape on it. It said, DO NOT OPEN IF THE SEAL HAD BEEN OPENED. How ironic.",4/23/14,0
146204,Very Disappointed,Manuel E. Ramirez MRamirez,R3CEF8V7QZTX3A,It is not true. It is not unlocked. I purchased this and I received an European Model.... I need you to solve me this issue.,4/21/14,0
179025,garbbage,Amazon Customer,R1NOP3VEE1JBGG,i thought this would have being a good buy but it was a waste of money. batteries dead dead dead.,4/4/14,0
150603,Massive Of Chunk,Rick Nichols,RAR7YWFA5G9QG,TOTAL RIPOFF. The manual is beyond inadequate. Even my techie friends were baffled. DO NOT BUY THIS PHONE. The language was defaulted to Spanish and most of the instructions were as well.,4/29/14,0
183014,>:(,ISMAEL RAMIREZ,R2F7Y8TAVI6HUA,"I don't know why, but the screen on several occasions doesn't want to react. It maybe a problem with the touch. I regret to buy these phone, sometimes i can't use it, and i have to take out the battery, and turn on again. This is the only problem.",4/4/14,0
175560,Phone Died After 4months,Julia,RUC8XETS66IEU,"I purchased this phone in January. The device worked as expected and I was pretty happy with device given its performance for the price. However, today the phone just stopped working for no reason. One minute it is on the next it is off and won't turn back on. There is no obvious physical damage to explain this, and its not the result of water exposure. Very disappointing.",4/9/14,0
28957,New? Hardly,Karen Wilkins,R2MELRSP78Q5DR,"This phone was sold advertised as new. I don't know how that s defined by #XIV Wireless, but when the phone turned out to be defective after 5 months, XIV can't help and Nokia tells me the warranty is expired. XIV wireless may have followed the letter of the advertising law since the warranty was not mentioned in the blurb, but it is not unreasonable for someone to buy something new and expect it to be covered by manufactuor warranty. Buyer beware!",4/22/14,0
165533,worst thing ever,tiffany,R2VL0SRJDIYCWR,"worst thing ever, i drop it with a case on it and cracked the screen in a week. crappy bs",4/16/14,0
153187,Very Unsatisfied Customer,Kevin R. Pruitt,RWEI2XK1T5DV6,"I purchased this device the first one didn't work, then I was sent a replacement. It does not work with ATT, the only time I receive a signal to make or receive a phone call I have to be connected to wi-fi. I spent $95.00 for the device and $16.00 to return the first one I will have to take a loss. I know now to follow my first mind there are certain thing that should not be bought online.",4/8/14,0
49902,Phone was good at first but....,Black Marze Da Impact,R87Y59NFZOO3M,"It starting having numerous problems I don't even want to list, my wife ended up sending it back home to get fixed and maybe sold to someone else...Don't waste your time.",4/24/14,0
153022,"This phone sucks, Do not buy it",Ricky Young,R2KKUI6CSD0DVQ,This phone sucks on picking up the tower. It keeps going in and out of service and it drop calls in the middle of the call. I have called my phone company and they have said that all the setting are correct and that I should be picking up full tower bars. DO NOT BUY THIS PHONE.,4/18/14,0
121730,False advertising - I received a locked phone,Deborah,R1OV1FINSZIVQ7,"I am extremely disappointed with this seller.  I ordered this phone as a birthday treat to myself because I really liked the phone and loved the idea that it was unlocked. When I received it, I took out my SIM card from my old phone and put it in to my supposedly newly unlocked phone, only to discover that the phone did not recognize the SIM card!! I thought maybe I was not doing something right. So, I took the phone in to our telephone service provider who told me, sorry ma'am, but this phone is locked. I ask the technician if he was sure and he said yes, positive.  I noticed that the phone also had Telcel which I know is a telephone service provider in Mexico.  I didn't really care about that, I just wanted the phone to be unlocked.  It is useless to me right now and so I am returning this phone. I will never buy from Mobile Best Seller.  I do regret not checking out the seller rating because I was just too excited to get the phone.Not a happy customer",4/5/14,0
25754,Not Internet friendly,michelle kenney,R3PQ7X9NU3LOSB,This phone did come with a charger so it did NOT fit the standard chargers and finding one was a chore..It did NOT hold a charge and you could not access anything other than tex and calls on this phone. I WOULD NEVER RECOMMEND IT.I had to go purchase another. .What a complete waste of my money and would feel I was robbing someone if I tried selling it. YOU ASKED,4/16/14,0
181656,Runs Android version with Heartbleed security bug.,Alex,RQPV4MCTIF0I0,"Runs Android version 4.1.1 which contains a major security flaw (Heartbleed bug). According to Tracfone forum, they are not going to update the operating system in order to fix the bug. The bug can lead to having your private information stolen, so I cannot recommend purchasing this phone.",4/19/14,0
184582,Never get one of those phones ever again,Shamica Latrice Nelson,R1ZN29ZHQO5DYE,That phone was the worst. It cracked and I didn't like it at all.. And one of them just blacked out. And their very slow,4/5/14,0
152032,WOW THIS PHONE SUX,daniel,R14S2FPSZUAWTN,THIS PHONE IS A MESS.  BATTERY DIES AFTER 3 HOURS OF USE FROM FULL CHARGE.  VERY SLOW PROCESSING AND POOR QUALITY.  REASON I DID NOT RETURN IS THE PRICE WAS 49.99 I CANT COMPLAIN TOO MUCH SINCE IT WAS DIRT CHEAP.,4/2/14,0
182814,very bad for sony flagship phone,vic,R9NGJXTAJG7YT,Bought it a month  ago and to factory reset 2 times already  because it keeps freezing up and reseting it self. Sony customer service is really bad and.won't take care of problem. And last thing it's not really waterproof took it to shower and it stopped working,4/4/14,0
39447,IPone does not work,Julio C. Hernandez,R25TDVQFPKRL7L,I received the IPhone 4 and found that the microphone does not work; I spent a lot of money for a paperweight.  I want my money back.,4/21/14,0
163863,Bad choice,Leslie Washington,RS5ZB2ODIOU7K,"Nice phone, but it will not connect to server, i asked to return it the same day i received it and i was told to send picture of how sim card is inserted. Know one wants to hear that their not smart enough to put in a sim card, but I done what was asked and i havent heard anything else from the seller, the phone does not work.",4/28/14,0
59010,This is NOT the phone for ANYONE to use!!,Amazon Customer,R20BGD40TEH82B,KEEP YOUR MONEY!! VERY Bad choice for a phone!! Doesn't operate nearly as well as an android phone should. My mom can't even use it half the time because it freezes so much and all the games & apps she had downloaded suddenly disappeared when the phone updated if that's what you wanna call it!! Definitely want and need a refund on this. Total ripoff!!,4/25/14,0
89203,NOT what It shows,Sakshi Chhabra,R1HCCF1ATR64B1,It doesnt work well internationally and it does carry a carrier logo which they say they dont .. I am not satisfied with this purchase at all ..,4/19/14,0
80471,Not Happy,weewee,RUNRBYKWISDAF,A week after I received it the screen cracked.I didn't get any use out of it.Since I paid my money it should've lasted longer than a week. Was very upset.,4/25/14,0
138684,Sucked,Austin,R2KN421OSIBE3Q,I chose this rating because when i got the phone it didnt work right from the get go. I tried to return it and i havent even seen my money back from these guys.,4/3/14,0
86744,i was very and happy and my daughter too,vanessa,R1J212C1WXVVNU,the phone is damage and i had to buy anew battery and the phone still doesn't work and i had to send it back for a refund iam upset cause it was a gift for my daughter and i had to take it back from her and she was very unhappy,4/10/14,0
163864,no service,adrianna spann,R3FFRYCUX2OHYM,Pretty phone but service is horrible. Wouldn't recommend to buy this item. Good when outdoors but when inside nothing works,4/11/14,0
157522,Regrettable Purchase,EP,R31KTIONJF5U4B,"I am not happy with this purchase at all.It was listed as gently used, that's not true. There were scratches which didn't bother me, but the phone won't connect to the server properly (internet and apps do not work with data/internet). Both the speaker and mic malfunction, causing a lot of frustrating phone calls. I often have to hang up and call on a different phone to hear and be heard. The phone does not come with a SIM card, so until you get one you can't use it anyway. For theomen spent I wish I had just Purchased a brand new one that had a warranty.I'm very disappointed, because I trusted that Apple would provide a quality product (especially for a couple hundred dollar purchase). I will never purchase anything from Apple on Amazon again :(",4/25/14,0
149096,was incomplete,Emperatriz Rosso,R1BEJ2BX3O9IO9,I had no battery samsung but a nokia and comes without headphones. I am very disappointed. Would not recommend. No guarantee because they do not provide good service.,4/25/14,0
183610,No talk and data,Kirstin Becker,R264DXGHZNSDNS,This phone is such a disappointment.  You cannot talk on the phone and use data.  Huge step backward.  Shame on you Sprint.  The heartbeat monitor and pedometer barely work.  I am annoyed every time I pick up this phone.  I called to try and get it exchanged but was on the 16th day.... there is nothing they can do.  I used the voice and data simultaneously on my old phone all of the time.  This is unacceptable.  So tremendously disappointed.  $350 to cancel or I can buy a different phone retail.  Terrible.,4/29/14,0
94302,doesn't hold a charge,Cheryl Sivan,RLHQNDU93IMYW,My phone is just a little over 6 months old and i have had repeated problems with it charging and holding a charge. I have tried different chargers to no avail. Overnight it went from a charge of 69% to 18% and now it won't charge at all when i am just getting ready to leave on a business trip.  I would expect more from a $300 phone than a warranty of 30 days with something so basic as charging and holding a charge.,4/13/14,0
167597,Not the best,Sara Nowakowski,R2VHELV0YVNBSF,"I recommend putting the money you would spend on this phone to a better phone.  It shuts off when talking, sounds muffled when you talk to people, is hard to hear, and tells me my sims card is missing even when it is firmly in place.  I would avoid the Android brand, I got there tablet and it was bad too.  Stopped working within a few months of purchase.",4/21/14,0
166666,product purchased does not match what,aldo linero,RH2BX79Q4IQO3,I write so I received the following phone that do not match the code of the device with the code that's in the box also came with full of pictures and other things innermost memorized. so buy 2 new phones ... so I see are scams,4/8/14,0
85784,Isn't good,Armando Govea,RULE5WO3K5MKH,The phone not match that the description. It has so much fails. Please you would sell the correct items and not phones damaged,4/14/14,0
173581,Great at first but after a month...,Linda,R1FPK1DTTW6BNV,"Initially the phone was great, it was fast and efficient, perfect in my opinion. Then after about three weeks, the SD card began dislocating itself. Just today, I had to open my phone up and reset the SD card four times. It just keeps slipping out. It doesn't matter what I do, even if I leave it on the counter all day, it still dislocates itself. I tried to return the phone but was too late because of it's one month return policy. Now I am a disappointed customer who wishes that the return policy was longer or that they made exceptions. The seller is also impossible to reach. There is no button to contact him or her. Although this phone is great, the SD card cuts my service 3-4 times a day and I wish I could have gotten something or a seller that was more reliable.",4/6/14,0
164453,I hate this phone!!,Kayla Quigley,R1MXMH1NZVHXSB,This is the worst phone I have EVER had the battery goes dead on it so fast even when your not using it its ridiculous and the speakers on it suck it sounds like everyone you talk to is in a tunnel!,4/15/14,0
85334,Please double check your coverage area,Cassandra,RRWVO6U9B2V03,"We bought this device for my elderly mother. Before purchasing, we checked the coverage area listed online- using our zip code- and were delighted to see that we were covered. It was promptly ordered through Prime with their great two-day service. We just received this item and tried to activate it. Imagine our dismay in being told by the operator that we are NOT in the coverage area and would not be able to use this device. I have no choice but to send it back. Thank goodness, I ordered it from Amazon!Don't trust the company's (Great Call) online information. Call directly to find out if you are indeed covered before ordering this and spare yourself the trouble of having to file a return claim.",4/26/14,0
70515,the worst phone I ever bought,Pablo Lanetti,R2LSUPPL6BP6BX,the worst phone I ever bought 6 month after I buy this phone's operating system and phone does not work but also the BB techs say they can not fix the problem to be the operating system,4/9/14,0
121967,Fraud,Gabriela,R31R09GPCT3ZEQ,"Dear,I am very upset about that purchase,  is a used phone and I bought like new.The phone does not works, and is not original.That is a very disgusted experience and anybody give a solution.",4/16/14,0
104307,The phone is not unlocekd and it sucks.,Mike Young,R2TQ1SQ0H0U1U4,I expected a nice looking unlocked phone but what I received what a bruised unlocked phone. Didn't even realized it was unlocked till I got home and almost my friend because of it.,4/24/14,0
