,Title,Author,ReviewID,Texts,YMD,Sentiment
170394,Awesome Cell phone!!!!,Fireman26 FireMan 18,R27OAHVZRLGKKM,"My service is Net10 (Straight Talk) in Northern, Va. Everything works: Data, Text and Picture Text. You would have to go to its website to setup the data service with a new APN.I only have this phone for a day,  got it yesterday (03/18/2014).  I got it one day in advance ( Thank you Amazon for that) and I'd started to play with it right away.**The Best things about this phone (Version D802) is that, it does not come with any pre-loaded and annoying software packages from neither AT&T; nor T-Mobile or any other cell phone company. Thank You God!! So you are not limited by them.  However It does come with some LG applications as expected.You will love that the you can activate the Tethering on this phone since it does not have any limitation from Att or T-Mobile.  I have done it with my Net10 service, but I cannot abuse it otherwise my service will be cancelled by Net10This phone is like a rocket, very fast. Responsiveness is for a person whom want everything for yesterday like me. Again this phone is lightning fast!!.  The phone has a gorgeous and perfect HD screen. The colors are bright and the details are amazing (I'm not going to be too technical about this).Playing Videos (Netflix, Hulu Plus, The CW and more) are play without a hiccup, very smooth like a silk. Going through the movies on Nextflix is not frustrating anymore, you will see the icons almost right away. Now  my internet Service is Comcast 50MB Download, this also can play a difference while using applications that connect to the internet. Your responsiveness might be different.Streaming music via Pandora and Spotify is not a problem either.  Both applications work like charm while streaming.Speaker, i think is the weakest point on this phone. It is an average speaker.  I think LG could have done a better job with the speaker considering that this is a high-end cell phone. But not a big deal for me since a use headphones or my Vizio 5.1 speaker system.**Battery Life is amazing if I compare it with my previous LG G Optimus. The LG G2 with mild (phone call, internet use, chat, audio stream, emails) use from 6:00 to 18:30 I still have 76%. My one-month-old LG G from 6:00-16:00 is with 5-10%. I have not have a heavy use yet, but I will let you know how that goes. This phone also come with an international adapter and a head phone.The 2 taps on the screen to  wake up the phone, I like that. I found out that it is easier that trying to push the power button to wake up your phone.I found out that that it is easier for me to use both the volume and the power button on the back of the phone, since my index finger is right on top of the them while I'm talking.  I do not have to guess where the volume is anymore.I haven't taken my first picture  with the 13mb-camera or use skype yet.This phone has a Guest Mode, like the computers do. If somebody wants to use your phone, just switch it to Guest Mode and that person won't be able to screw up your phone, change anything or look at your personal information.  You can also decide what application(s) that person can use while on Guest Mode. Nice!!! Specially if you have children whom like to play with your phone or watch videos.Being an iPhone user (up to iPhone 5), I can tell that this phone is way better, even better that the iPhone 5s.This is everything for now, I will be back to let you know the rest.  I hope this humble review help you to make a more inform decision and remember that you might have a different experience base on your cell phone company and your internet service provider.",3/19/14,1
148993,She love it!,Gio,R9SR3IMYTEE0A,"I bought this cellphone for my sister. I think that it work for her. I didn't hear nothing bad about it, and she seems happy.",3/23/14,1
131745,Best Value for a Phone and Service - Samsung Galaxy Victory and Virgin Mobile.,BillFla,R1MKPPGEVUJSP,"Great 4G phone, fast processor wonderful screen. With the $35 month for 300 minutes and unlimited text and data and the low price of this phone I have a state of the art 4G smartphone and service for under $500 a year, tell that to your Verizon and ATT friends that spend 3 and 4 times that for the same service.",3/5/14,1
78813,GREAT PURCHASE!,carla,R2N7CIZ09MSYI1,Great Purchase. In great conditions better as it was described. Factory unlocked as it was described. It's been more than 5 months now that I'm using and working 100% for half of the price. I'm very happy.,3/27/14,1
62744,Good phone,Just me,R155MDDBNSR439,I is a little weak as far as the signal strength is for me but just be area in.Overall a descent phone for the price.,3/20/14,1
180977,Best phone I've ever owned by far,B. Covington DIY geek,R1PTRDFUWQDH9,"I've owned quite a mixture of phones over the years and this is by far my favorite. I'm a Windows Phone fan already but this hardware is fantastic. The display is amazing - sunlight visibility is great and works better than my previous WP8, the Lumia 810. Photos are incredible and I don't mind keeping the SLR in the bag for quick shots with the images I can capture with the Icon. Videos are great and audio is pretty impressive - normally audio recording levels are off and you get clipping but I haven't had this issue at all with the Icon, even at loud events like the Daytona 500. The only thing missing on this phone is a card slot for additional storage, otherwise it is fantastic and doesn't warrant a reduction in rating since I offload photos and videos regularly. My wife has the same phone as well and, coming from a Galaxy S3 and without exaggerating, tells me every day how much she loves this phone. WP may not have every app available but the core functionality of calls, texting, internet searches, photos/videos, maps/navigation, voice control all work well and faster than anything else I've tried.",3/31/14,1
154239,Good basic phone,DUY TRAN,R13C8X1N3GSNTN,"It's a very good basic phone, works with both SIMs as same time; used as an emergency phone in my car.",3/17/14,1
83487,great purchase,sudani scott,RZP1Y096B5DVS,this came with very few small scratches.  everything works and my daughter loves it!  would definitely recommend to someone else.,3/11/14,1
171545,great phone at its price,Francsico,R1B6TWQXMOG9TQ,great phone might just get oe for the ehole family really enjoy this phone and just great at the prie yu cant beat taht,3/9/14,1
148444,Most impressive,jBj,R1B21W90NCJEXC,Purchased the Lumia 925 after cutting my teeth on a Lumia 521.Moving up to the 925 for me was an easy decision seeing how well WP fits my wants.Very elegant device!In need of a case for the phone since I'm terrified I'm going to something clumsy.Excellent piece of hardware.A definite winner in my opinion.,3/17/14,1
61703,Recieved more than ever expected!,Arysta Argabright,R216ZI0KC553YE,"It is a pleasant surprise to have received this, let alone any package ordered online, and be completely satisfied. It said fair condition- meaning heavy wear from normal use- and I would have to say it was much better than fair! Barely any blemish on the screen, no physical damage or wear on housing of phone. Battery cover was not broken or worn at all and battery holds a long charge as desired. I am completely satisfied with this purchase and seller and would recommend to everyone.Thanks,your happy customer!",3/31/14,1
179585,great phone,Judy Billheim,RCUXRAGTOAEFK,"this model is perfect for my needs, of all the tracfone models I have had, this is the one I love, this model should have been out long time ago.",3/29/14,1
132273,Excellent,Nicholas Bailey,RBXJALU65TF53,This phone exceeds expectations. I have tried all the top brands and for price and function this is the best deal!,3/1/14,1
179837,phone,maranda besherse,R30KQZMITPS6PG,I have not got it yet but as soon as I get it I will like it I hope any wat,3/3/14,1
138399,Excellent,Winston Gonzalez,R81I6DXVO5VTF,"Congratulations i recommend this product for more people, i really satisfied with my Sony Xperia L C2014 Unlocked Phone, good job",3/2/14,1
55132,Nervous for nothing,Kristy S.,R2I2F8LD8XGX1Z,"I've never bought anything refurbished & was VERY nervous about it but, not only did I receive it earlier than I thought it also was in great condition. It hasn't given me any trouble & everything works well. Plus I was just supposed to get the phone but was also sent a cord.",3/24/14,1
139554,Very awesome,Alvaro,RQP7DGY6VPDYD,"I was not in US, than I bought it and sent to my boss hotel, it arrived in the agreed date, I am very happy with the mobile",3/6/14,1
133963,Excellent for the price.,Rodney C. Wilson,R2ZHD6DTJ5EFPS,"This phone is not the best I have seen but when you consider the price it is the best Android phone compatible with AT&T; 3G network and unlocked.  Many cheap GSM phones do not support the frequencies used by AT$T.It is elegant looking with nice feel to it. Call quality (even in poor service areas) is excellent.  Good speaker, OK screen, OK camera, great battery life.  Not the fastest but I suspect it is more than enough for the average user.  I tested data speed while tethering this phone to a PC and it clocks at 3.6mbs. That is almost the same as my Samsung 4G that cost 4 times more.  The Bluetooth works much better than other phones I have had with great sound through my car stereo.  I have been using it for a while now streaming internet radio while driving and that also works really well. Just buy it, you will love it if you don't expect it to work like a $400 phone.",3/26/14,1
70385,Thanks,Aleina,R2NCAG1B3LRRRB,this was a good replacement for my 14 year old that keeps dropping and braking her phone it is holding up nice.,3/27/14,1
150692,Nice cheap phone,Marc,R36WAEMLXSUULV,"Performed as advertised. Needed a cheap phone for overseas with a qwerty keyboard for texting. Battery life is great. Phone is very tiny though. Maybe because I got so used to my 5 screen smartphone.I bought two, one for the wife (white) and one for me (black).",3/14/14,1
155853,love it,K. Larson,R3PDZHAKLEE9MH,"love it, comfortable to hold.  have not had any problems.  the best phone i have owned to date. definitely recommend",3/29/14,1
168612,N5 - White,Ed McBride,R3CZJ5ZZ47RWO9,"I love this phone. So much better than my previous phone. It's so fast, and responsive. It was also such a great geat, I couldn't turn it down",3/11/14,1
176802,Best Andriod phone there is,Eva,R2I3THHQN7WLU4,"I don't understand any complaints for this phone. It's flat 5 stars - no discussion! Big screen, fast, unlocked and affordable!!  Why pay $500 for the phone? What is your precious Iphone can do that this one can't? Nothing!!! I love it. Only wish I would got 16 GB",3/8/14,1
65749,I love TRACFONE,Ward Martin,R7B2UVYXXFP9L,Perfect for my needs (no need for 2 year contracts). I love it!. It takes my about 5 months to use it up. I don't use the phone that much.,3/7/14,1
138140,LOVE OF MY LIFE!!!,Tysheena,R1JIT6ASKNJEEX,"This phone is the best! Came very fast, works well and came with two batteries!! GET THIS PHONE!! I just slide in my sim-card and it worked with no problems",3/13/14,1
150173,just what I needed!,Mom of 4 boys,R32W0E7RZBVHAL,"I switched to consumer cellular and I wanted a small cell phone that would fit in my pocket, connect to my iPad and macbook calendar and also pick up my email. (I have an iPad and macbook at home with my calendar and set up a gmail account *for the phone calendar* and was able to link them all!)  You just need to enter every event as a gmail event, not an iPad event, or it won't show up on the phone's calendar.  This phone does the trick.  The price was reasonable and the android system is good, even though it is older.  I did have to set up the APN settings in order to get data with a help desk specialist at consumer cellular for  the data to work.  Also, it was doing a little butt dialing until I discovered how to stop it.  Not only do you have to set up a screen lock, BUT ALSO, you need to always hit the HOME button, then the red button before putting it in your pocket.  no more butt dialing or butt texting going on here.  You also need to buy a micro sd card to take pictures and download any games to increase the memory.  Now, we have 3 phones (home, mine and one of my kids) through consumer cellular for $80 per month.  We share 5000 texts, 2000 minutes and 500mb of data.  If my son wants to use a bunch of data at home on his phone, he just turns on the wifi (he bought an unlocked nokia lumia 900 and also had to set up the APN with the help desk at consumer cellular).  great way for me to have a cheap smart phone. If you want the latest and greatest, this is not it :) (the nokia is great though and much cheaper than an iPhone) but I personally do not need an excuse to look at my phone any more, I just need it to communicate and see my calendar!",3/15/14,1
181045,My brother is in awe,Misslillyinthevalley MissAngel,R2BDT3D8UCZ907,I got this phone for my brother. He loves it. He uses it every day. he was fascinated with the dual sim slots lol. He plans to keep t for a long time. It's a good phone.,3/3/14,1
133520,good phone,Ellery Gonzalez,R1ME4K4F0FEQLT,excellent phone meets all my requirements in addition to their specifications are excellent value for money compared in order is the best option I saw at the time of purchase.,3/17/14,1
181625,Love this phone!,E. G. Natale tech wannabe,R24IQRV2SPVKP6,I finally took the leap into android territory with this smart phone and I am very pleased. I chose it after reading reviews on Amazon which helped to inform me of ways to work with this phone. I barely use any data choosing instead to use wifi at home and free wifi when available while I'm out. Oh... and I am also loving playing Words with Friends on it!,3/19/14,1
185285,love it,John Owens,R3V3403CXI9NJ,It looks like the I phone and it can fit into one of the original iPhone otter boxes which helps in my line of work. I've had no problems what so ever with this phone I bought 2 of them now.,3/10/14,1
88003,Best phone I've ever owned!,BT,R1T3G7B6V32QIW,"Had one for several years and finally had to replace it. Rugged, durable, and most of all, it keeps and makes calls in marginal areas where calls get lost by most other phones with the same provider. Not a smart phone but smarter than your average basic phone and I LOSE LESS CALLS!!!",3/27/14,1
139366,Just Perfect!,karisha,R359DSDQ6IBS6X,It was like I went to the AT&T; store directly. It arrived to my house quickly. This product is just awesome.,3/22/14,1
103915,Great phone!!,Adrianne B,R25XY0YELNH68A,"The ATT S3 works fantastic on Straight Talk network in Upstate New York, just put in micro SD sim card and good to go! Even get 4G which is much better than the ATT S2 I was using previously.",3/15/14,1
168788,I love it,Johan C.,R1EL79O5QXDVZM,recommended,3/11/14,1
108297,10 OUT OF 10 AS PROMISED.. BUY THIS!!!!,Ms Boston617,R3BAQTF78FVMYK,The Samsung galaxy 3 is an awesome phone as I have had one before. My phone was delivered way before expected took about three days. I had to sign for it which I appreciate as my packages are always left in the hallway. Phone is in great condition looks like it was never used not a single scratch on it!! Came with original battery and charger as promised!! Had it activated in minutes through the automated system. . Would most definitely use this vendor again..,3/13/14,1
115558,Great for elderly person.,ROBERT CLEVELAND,RMCQ5GB86IKD7,My wife was having a problem with small numbers on other phones and this fits  the bill the bill. Great for emergency type phone,3/6/14,1
173174,Very satisfied.,Mihail,RUJPWJNQ66QYW,"Best phone for masses. Battery works just great for one day hard usage - I was able to watch four 1.5 hour movies through WiFi from local NAS and still had about 15% of battery. The same applies to internet browsing. It's possible to recognise screen content under direct sun lights. Screen glass quality is also just perfect - very easy to clean and it's scratch resistant. GPS positioning is very accurate and GPS fix is fast. Camera doesn't work good for objects in motion.No SD card slot inside - looks like the only missing option, I think. After installing offline navigation maps for Europe and North America, after downloading Google Translate with offline dictionaries for 3 languages, after installing every app I need, I'm still having about 5GB of free space inside.I do recommend to buy a case because original phone cover is a bit slippery.",3/13/14,1
69834,I love my iPhone.,Kimberly,R3NXFUYPBJWPOA,I was really worried about buying one refurbished but it works fine. I had a little trouble with the camera for a little while but it's working just fine now. So glad I bought this one instead of buying one brand new. Works just as well.,3/13/14,1
112030,I love it!,Amazon Customer,R25OUHVAHJN8CY,I got the best deal when I purchased this iPhone 5 for my mom because the price is awesome for 32GB.,3/28/14,1
176853,easy to use,Sharee Cohen,R1OPL90BUTJ0WZ,"After a normal learning curve and finding the correct user manual, this was an easy phone to use.  Glad I bought it.",3/1/14,1
143505,Bought as a gift,Ron Texas,RRWDUXNYKJ14J,The user is very happy with the purchase.  Love's it so much a friend has decided to purchase one for himself.,3/1/14,1
144064,Beautiful phone. Better than my note 2,Amazon Customer,R6063HP7NV70R,I had the note 2 and loved it when I heard about the mega 6.3 I had to have it. This is the best phone I have come across. You read so many reviews saying how big it is I'm telling you don't go by what you read. If you own or even seen the note 2 or 3 its slightly bigger than that nothing to freak out about. It is pretty much identical to the note 2 or 3 so don't let ppl make you second guess it you will love it. I know I do. Also I received the phone a day and a half after I ordered it very fast shipping.  :),3/29/14,1
140750,Good entry level Windows Phone,"The good, the bad and the ugly",RL06M9ABBBGZK,"This is a decent phone for the money. Do not buy a non US version of this phone, you will not be a happy camper it you reside here. The only real thing this phone is lacking is a flash for the camera, other than that it has all the rest of the normal smartphone functions. Really nothing else compares to a Windows Phone. You can have your Apple's and Android's, I will never go back. You want a Windows Phone, especially if you use your phone for any business activities. Simply the best, Office already there, Skydrive auto upload feature of all your pictures so they are immediately backed up. Manages multiple email accounts with ease. All your contacts and everything linked to your Microsoft account so if you loose or break your phone, they are still their. Simple, easy to use, never continual updates like with iPhones that seem to take hours. Longest update will be the first time you plug it in and get the software current. After that, maybe a five minute update once a year. I highly recommend any Windows Phone made by Nokia or Samsung. I am still using a 3 year old Focus Flash that has hit the ground so many times I can't even count anymore. Swimming in mud holes, dropped from two stories up onto concrete, flies into pieces. Pick up the pieces and put it back together again just like Humpty Dumpty. I will say the one thing I look for is a metal case like my Focus Flash has, they last longer. This one cannot handle falls like that one can but it is a whole lot cheaper and wont break the bank if you break it.",3/19/14,1
173868,excellent buy,carlos rivero,R234QVSB4KVAT6,"I am really having fun with my new phone. It works just perfect with Movistar in Venezuela, I recommend it fully.",3/8/14,1
133121,perfect,Elizabeth C.,R1JJ52NVLYU2DR,"Best mobile phone ever, a little bit late in ship but anyways everything I expected!!! Htc is one of the best mobike phones evet",3/1/14,1
160338,best phone on the planet,Amazon Store,RHR94NKSY3OAX,best phone on the planet. its worth the money. you wont regret buying this phone. I love all the new features,3/22/14,1
170356,Perfect for me,AMC,R3STQ8JK2X7TKC,"This is a great little phone. I refuse to get into a contract since the prices are ridiculously overpriced. 3G really isn't all that bad and I don't really notice that much of a difference from 4G. Plus, if you have wifi at home (and most establishments), why not go the pre-paid route?",3/13/14,1
161733,Great,Kayani1120,R27I5TXG1PP2HF,iPhone is great Work so for I'm happyI need one more phone like that but 32 gbPlease gave me answer,3/28/14,1
169665,100% recommended,Mario B.,RJKHRPNBNG2ZR,"the phone is very good, fast and has a very nice design. is very comfortable to handle and the camera is good 100% recommended",4/14/14,1
174401,Better then Galaxy S2 !,Smit Patel,RQMU0RN93SU20,"Amazing phone, love it so much i had a Samsung Galaxy S previously and it broke on me so I bought this, it is a premium phone at really really cheap price also i should mention I had Galaxy s2 for few month but I like this way better then the S2!!",4/2/14,1
47182,thank amazon and sellers,jorge,R3KQWW40O4T1TD,thank's This phone is excelentes i like.  you have free hands for sale and case for motorola atrix thank's thank's,4/2/14,1
161895,Very good,Victor,R1VTZIBS725T28,Very nice brand new team in its case. 100% satisfied with the purchase. Unlocked H + and running on smoothly.,4/21/14,1
17559,Great flip phone,Geneva Kervin,R3EI5KIVDZJM64,"I bought this for my husband because he doesn't like or want a smartphone.  He had an older version of this phone, many years old, and it  lasted forever until the battery finally gave out.  For about $50 more I was able to get him this new one.  It is a great little phone, very slim and light, and the camera and standard features work great.  Would recommend for someone who just wants a phone for making and receiving calls, simple texts, and a few pictures here and there.",4/1/14,1
176528,Excellent phone for anyone on a budget,Calicia B. Charles,R1RLAD8GLO1IJL,"After reading reviews and watching youtube videos, I decided to get this phone for my bro. He loves it. It's a sleek black design and its really nice to hold. It comes with android kit kat already on it and little to no bloatware, almost stock android. The resolution is also excellent, I was really surprised at how crisp and sharp the screen was. Programs run smoothly so far with no lagging. If you're on a budget this is definitely the phone to get, no need to look further. It is also unlocked for any carrier as I am able to use it in the Caribbean.",4/16/14,1
125921,Great little phone!,Jim,R2FJ8KDL134A43,"It's a great phone for the price, and it functions well.  The triple minutes and 3g/wifi connectivity makes it a nice phone!  The only down side is that it's not an android, but it's still good for the price.",4/3/14,1
88871,Enjoying the phone!,Pegogo,R1OSY9FX50CAWF,The phone works wonderfully!! It was a lot cheaper than going to Walmart for a prepaid phone. I love this phone it is so much like my old envy.,4/24/14,1
174379,You will lose almost 4GB to the OS and 2GB to your apps to end up with about 10GB,Rockerfeller Jones,R1Y22C7138OS7Z,"This is a great $200 phone, but bear in mind that you will only have 10GB of storage space for the rest of the life of the phone.Almost 4GB will be used up by the operating system (unless you root it and delete apps you don't need) and you'll use up initially at least 2GB when you add the traditional apps that you'll need to use the phone as a smartphone. That leaves about 10GB for user content, which, for most of us is just fine (pictures, videos, movies, etc.). So, as long as you KNOW that you'll be missing 6GB of the 16GB after the first week, this is the BEST VALUE for a $200 phone on the planet!",4/15/14,1
147969,nice phone.,Michael k may,RR4EA5DSO1RTY,Truley an incredible phone. Caint belive how fast this thing is. Does take a little to get use to .,4/14/14,1
146203,Excellent product S4,Miguel Vasquez,R1AA0M1NZBECJD,"Excellent product. Samsung is Samsung. Nothing is similar. excelente producto. No hay otro igual,a menos que sea el S5. Thank you",4/26/14,1
149090,Best buy without deception,Clark J. Rincon Cohen,R23WKPSKMOKYJH,"Excellent phone, one hundred percent new, original and unlocked. I had previously purchased another computer, another shop and result in a locked cell and rebuilt, now otherwise all according to what was published.",4/30/14,1
90479,SIII Qualification,Francisco,R3FE8LL349PAKK,"excellent device, working perfectly in Brazil.Recommende for sure.recommend would definitely know how to buy the site to deliver in Brazil",4/25/14,1
181633,Great Phone,Neotoma,R34ONHZ1SPH475,So far I am pleased with this phone. This is an upgrade from a Lg800g. A little bit of a learning curve as this is my first smart phone. The reception is excellent and significantly better than my Lg800g phone ever was. The WiFi reception is good but not as good as a lap top. The only thing I like better on my previous phones was the way text messages were displayed by order received.  I dislike the new messages building on previous messages from the same contact. Overall I am pleased with the phone and would recommend as a good first upgrade to a smart phone.,4/21/14,1
20287,Great phone,Schweidel Tyson,R34H405GFA3UPZ,"Best phone I ever had. I didn't realize it until I had lost it and used other phones. It had everything, timer, radio, voice recorder, etc.",4/5/14,1
160742,excellent team,efren bastardo,R36VIODQJ9ATYJ,"my first iphone was more than I expected the truth must be taken in hand, to live the technology in its broadest concept, I can say here really does not represent what you can do with it, I think the limit of team is the imagination of the Board Index",4/12/14,1
