star,comment9,9.1정도의 평점을 주고싶음. 고어물이라기보다는 좀비물이 오히려 잘 어울릴 듯. 연기를 다들 진짜 잘함. 하지만 무당이 황정민이 아니었다면.. 하는 생각이 듦. 갠적으로 부제 캐스팅이 진짜 잘됐다고 생각함ㅋ  
9,별 다섯^^무시무시한 감독입니다ㅡ수많은 영화가 떠오르고많은 것을 생각케 해주는 명작  
10,끝이 다소 함축적이였지만...156분이란 긴 상영시간이 절대 지루하지 않았다. 한 장면을 놓칠 수 없도록 완벽히 설계된 영화..  
10,라닝타임 2시간30분 정도되는 굉장히 긴 시간이었지만 전혀 지루하지않았고 처음부터 끝까지 이렇게 몰입해서 본 영화는 정말 처음이었다 . 관람객들도 모두 영화가 끝나고 나서도 완전 얼이빠진 상태로 숨죽이고 있었다  
10,나홍진... 근 5년 간 추락을 거듭하던 한국영화를 홀로 멱살잡고 캐리하다.  
10,곽도원은 더이상 조연이 아니네요 연기짱  
10,또보고 또봐도 재밌는 영화  
10,영화 너무 재미있었어요  
10,왕재미.빅재미.굿굿  
9,최근 본 영화중 가장 재밌었다.  
10,재밌었어요 내용 추측하며너 보기좋은영화마지막은 멘붕  
10,내인생 최고의영화 웅느오 굿이에요  
10,진짜 재밌게 봄 짱짱 본 후에도 결말 해석 다 찾아본 영화는 이 영화가 처음 그정도로 여운이 남는 영화  
10,확실히재밌음.생각해볼거리가많다.  
10,비오는날 봐서 더 재밌게본 영화.  
9,재미있어요재미있어요  
10,한국영화중의 최고의 걸작 완전 강추 감독이 의미하는 여러가지 복선이 숨어있다  
10,곽도원 황정민 연기 진짜 잘함 ㅋㅋㅋㅋ  
9,영화가 끝나고 이렇게 의견이 분분한 영화도 오래간만이라는...감독의 말을 애써서 찾아보는 수고로움도 감내하게 하는 영화^^  
10,소름끼쳤다...감독의 복선에  
10,소름끼치도록 놀랍고 재밋습니다~  
10,무수한 물음표를 남겨둔 채 끝난 영화이지만 그만큼 생각할 거리를 남겨두었다는 점에서 의미있어 좋았습니다.  
10,재밌어!정말재밌어 또봐또봐  
10,전혀 예상할 수 없는 반전에 내내 쫄깃하게 보았습니다!  
10,반전에 반전을 하는영화굿  
10,정말 몰입해서 봤어요 시간이 금방 갑니다  
8,"반전, 반전. 영화끝나고나서 궁금해지는...  "
8,배우분들이 워낙 연기력이 좋아서 보는 내내 긴장감있게 보았네요  
10,보기가 힘든 영화였다. 결국 난 미끼를 물었다  
2,뭐밍  영화가 무슨내용인지를모름ㅋ  
6,ㅇㄷㄱ디읻ㄱ니읻ㅅ읻ㄱㄴ이  
6,헉 우와 이럴정도는아니고 나름 괜찮았습니다  
2,재미없어요내용도없고 이상한영화  
5,어지려운 세상...  줄거리가 이해불가  앱툰 만화인듯ㅠ딱히 생각나는건   무시중한디ㅡㅋㅋㅋ  
10,스포를왜봤을까 후회중  
10,곡성잼잇다 꼭봐라 잼잇다  
10,재밋습니다....ㅎㅎㅎ  
8,복잡하고...음~ 진정 뭣이중한거였는지 모르겠는 뭐 그런 아이러니한?  
8,음..으시시~끝까지  내용을  잘 이해못한 일인 ㅋㅋㅋㅋ사람들평가보고  이해햇지용 ㅎㅎ  
10,진짜 어마어마한 영화 최고입니다  
5,그럭저럭 볼만해요..  
7,보는 내내 힘들었다..  
4,그냥~그냥~여름겨냥해서~공포영화하나 급하게 오버해서만든거같음...~  
4,거하게 낚였습니다..  
10,나홍진 감독님과 배우 모두에게 박수를 보냅니다  
8,몰입도가 엄청 나고 여운있는 영화  
9,황정민이 바지벗는 순간 나도 모르게 그가 귀신이거나 한편이라는걸 알게되서 소리를 내고 말았네요...잼있게 봤습니다  
9,긴장감이끊이지않앗던영화  
8,어렵네요. 몰입도 최고!  
8,반전에반전... 관람내내 긴장하느라 기빠졌던영화  
10,관람 후 토론을 하게 만들어준 고마운 영화  
9,재밌습니다. 뭐시중헌디. 곽도원의 우는 연기 과잉만 아니면 다 좋았음  
10,사진기 무서워맨 일본할배요  
9,비오는날 봤는데 무서워 죽는줄 알았습니다..  
9,황저민연기력!!최고에요  
6,"악마의 편집,  관객에게 들키지 않으려고 짜집기에 너무 몰두한 영화  "
6,소문난잔치  먹을게없다 기대이하 영화네요 무당황정민도 어울리지않코!!  
8,결말을봐도 모르겠다 해석을봐도 모르겠다  
7,15세 관람가라기에는 좀 무리가 있는 듯하다.  
10,다보고나서 한번더 보고싶다 라는생각밖에 안함  
10,재밌다재밌다재밌다재밌다  
5,내용이  너무 어려워요^^;;무서워요~~~  
10,재밌네요 여자애가 연기를 너무잘해요  
8,무섭지만 한국엉화 잘 만들었다  
8,앞선 사례가 없던 새로운 장르의 개척이라고 생각한다. 한국형 서스펜스 스릴러 / 결말의 급마무리 전개와 천우희 캐릭터의 활용이 조금 아쉬웠다  
7,배우들 연기력은 인정. 스토리의 설득력과 결말은....음..  
9,뭔가 숙제가 남는 영화 ㅋ  
7,무서워서 힘들다. 영화에 기빨린느낌  
8,최근에본영화중가장좋았다  
10,기대이상인영화...  
10,진짜 최고다 굿이여 아좋다  
7,엔딩이 끝나고도 관객이 영화가 말하고자 하는 바를 읽을  수 없다면 그 영화는 실패입니다  
5,내용을 이해하기가 어렵습니다...좀비 부분은 쫌 황당하기도 했고...  
7,"무슨 이야기를 하려는지 이해하기 힘들다. 한번 더 봐야 이해할 것 같은데,  별로 보고싶지는 않다...  "
5,온갖 잡신이 다 동원된 느낌이랄까 갈피를 못잡게하는 그런 찝찝한면이 있다  
4,기대만큼 아니라 아쉽다.기대가 큰것인지 남는게 없다..  
9,"뭣이중헌디, 대체 뭣이 중헌디!  "
10,절대현혹되지마라아라러라라  
9,제목을  미끼로 해야될 듯~  
10,최고다. 정말..다시볼까 ㅎ  
9,영화보는내내 뭐지?!?!하면서 끝나는순간에도 뭐지?!?!이랫는데 나중에 결말찾아보니 그때서야 소오름 ㅋㅋㅋ감독이 위도적으로 관객들에게 혼란을 주기위한것이엿단걸....최곱니다!!  
5,전작들에비해 재미없음 메시지 전달력낮음 안무섭고 지저분한 코미디극 느낌.감독수준이 낮아졌나~지나치게 은유 상징화해서 딱 와닿는느낌없고 깨달음 감동 공포도 미약. 다음 영화는 잘좀부탁합니다 ^^  
5,솔직히 이렇게 까지 평점이 높은 이유를 모르겠네요.기대를 많이 한것도 아닌데 스토리전개 아쉬움~배우들 연기는 돋보임~ 연기가 아까움~  
6,시각적으로 너무 잔인합니다..도대체 영화가 얘기하고 싶은게 무엇인지 알수없어요..끔찍하고 잔인해서 영화보고 나온뒤에도 뭔가 이 찜찜함은 어쩔수가없어요  
7,긴장감은엄청넘치는데~너무허무하게끝남  
6,기대보다는 별로.. 호불호가 확실히 나뉘는 영화  
5,결말도안갈쳐주고ㅡㅡ검색하게하네ㅡ  
7,끝까지 풀릴 듯 안풀릴 듯... 감독의 미끼질에 오락가락. 하지만 결말은 물음표  
7,이해가잘안되는영화 ㅎ  
8,아무리 연기여도 그렇지 그 어린 애한테 이런 역할을 시키다니.. 보는 내내 미안하고 짠했다.  
2,잔인하기만하고 마지막이 허무...ㅠㅠㅠ  
8,내용에 뜻은 잘모름!허나 배우에 연기는 넘 잘고 괜찬다  
10,썩 명쾌하진 않은데 재밌다.  
2,스토리가 이해하기애매하고결말도흐지부지...무슨얘기를하려는건지...  
4,언데드의 등장에서 GG이런저런 영화 참고는 많이 했는데 깊이가 너무 없다  
5,귀에 걸면 귀걸이 코에 걸면 코걸이  
6,생각보다 지루하고 복잡한 내용이어서 아쉬웠네요  
9,재미있는데 특히 반전 꿀꿀  
10,너무 재밌게 잘봤습니다 감독판이 나와주길  
10,정말 재미남 짱짱!!!  
9,"던져주신 떡밥 중에 아직 이해 안 되는것들이 있긴한데 그래도 간만에 재밌게 본, 잘 만든 영화였어요^^  "
8,쓰르라미 울적에의 전율 그것을 다시 느끼게 해주는 영화였습니다.  
9,매우 불친절한 영화지만 높은 평점을 줄 수 밖에는..  ㅠ  
10,혼자 조조로 보는 내내 입을 막고.. 혼자 중얼거리며 ㅋㅋㅋ 너무 재미있게 보고왔어요^^  
10,우악... 감독은 미끼를 던진것이여 근디 그걸 내가물줄 몰랐겄지~ 이 영화말고 뭣이 중헌디! 뭣이 중허냐고!!!!  
10,불친절하지만 재미있다  
10,3번봄. 취향타지만 호인 사람은 개호.  
10,긴장감 놓친적 없고 스토리도 연결 잘됨한가지 사투리 가끔 잘 안들리고어둡고 더러워서 잘 안보이는것도 있음  
6,재미있게 잘 봤습니다.. 별로 무섭지는 않았어요;;  
6,"순간순간 재미는 있으나, 뭔가 의미를 던지지 못하고 스토리의 재미 보다는 장면 장면의 스릴에 너무 의존되어 있다  "
5,잔인하기만하고 내용도 없고 끝도없는 최악의 영화였음  
9,처음 볼땐 충격이였고 두번보니 이해가 되더이다  
9,보고난후에도  자꾸 생각나게 하는 영화 인것같아요~무삭제편이 나오면 또 보고싶네요~  
7,초반이 지루하고 반전도 그닥  
5,내용이 잘 이해가 안간다.  
9,아가씨보다 재밌네요ㅋ  
4,보고나면 ....찝찝하다 비추임  
7,우리나라에서 만든 공포영화중에서는 괜찮은 것 같습니다  
9,절대 낚이지 마라. 이뜻이 뭔지 정말 알 수 있는 영화  
9,진짜정신적으로안좋은영화  
3,재미없어요.괜히봤어요.  
3,.... 분명 봤는데 뭔내용인지 모르겠음.  연기들은 다 잘함.  
7,내용을 모르겠다 ㅋ마지막이  아싶다  
9,소문보단별루네요그래도배우들연기력에는박수를보내고싶네요  
10,정말 숨도 못쉬고 봤어요  
5,"실제적인 요소인줄 알았는데, 판타지 적인 요소다.... 별로...  "
8,황정민 연기미쳣다 하앍  
10,무엇이 중한지도 모르고  
10,결론을알수없게. .여운이 많이 남네요  
9,긴장을 끝까지 놓칠수 없었고 재미있게 잘 보았습니다.  
8,배우들 특히 어린배우의 연기가 뛰어났지만 내용자체는 그닥..  
9,열린결말 좋네여 꼭 보세요! 긴장의연속!  
2,잘 만들긴 했지만 개연성은 어디갔죠?  
3,노잼 스토리가 산으로감  
10,재밌어요~~~~진짜루~~  
4,중간에 지루해 죽는줄ㅠㅠㅠ 거기다가 마지막은 진짜 찝찝해요..ㅠㅠ  
9,다시보러가여 열라 무서어  
10,상당히 재미짐 오줌쌀뻔  
9,곽도원의 연기변신이 볼만했음.  
7,결말이  개운치가 않네요ㅠㅜ  
5,똥을 쌌는데 똥을 덜 닦고 나온 결말 짜증나  
7,먼가 애매모한 영화 그럭저럭 볼만은 했어요  
6,뭣이 중한지고 모름서.  
8,아역 배우 연기 잘함 끝이 불공평 두악마도 없애야 하는데...  
9,솔직히 난재미있었고 또 신선했다단 좀비는 극중 흐름이 방해가 됐고추측으로도 좀비는 이해하기힘든 설정이었다  
7,현혹되지 말라 했음을 봤음에도 현혹되었다  
8,굳 세번봤는데 봐도봐도 모르겟으어  
4,찝찝한거같아유 보고나니까  
5,나홍진이 왜 비급영화를 만든거라고한지 이해도됨  
5,똥을 싸고닦지않는느낌  맨끝장면이..  
9,좀비가 좀 웃겼지만 몰입도는 짱  
9,재밌고아찔했어요~~~  
9,결국 관객이 낚시질에 미끼를 물었네요 ㅎㅎ  
9,화면구성력이라든지..내용이 이색적이다.이런영화가 있나싶다가도 아이러니하게 빠져든다  
10,"최고입니다. 왜 호불호가 갈리는지 이해가 안갑니다. 구성면에서 완벽합니다. 추격차처럼, 한시도 긴장감을 놓을 수 없는 진짜 명작  "
10,한국영화에 어마어마한 대작이 나왔네요 준비기간이 충분히 납득됩니다  
10,"재밌게 봤습니다. 잔인하거나 끔찍한 장면을 이용해 공포감을 주지않고, 스토리 자체에서 느껴지는 공포여서 더 즐겁게 볼 수 있었습니다. 평소 잔인한, 징그러운 장면을 못 보시는 분도 즐기실 수 있을 듯 합니다.  "
7,먼가 모를 찝찝함이 남는 영화  
9,정말  배우분들  고생한게보이구여..  아역배우  짱!  
6,생각과는 좀 달라 난해했으나 배우들 연기력은 좋음  
8,많은 생각을 하게 만드는 영화.살인의 추억이나 추격자를 예상했는데. . .전혀 다른 영화였다.  
3,기대보다 별로였음 캐릭터들이 다 짜증남  
6,하나도 안 무섭디다 지ㅣ루하기만  
3,내용파악이어렵다주제를잘몰겠음  
6,무섭다는 느낌은 크게 모르겠음. 중간중간 깜짝놀라는부분이 있고 영화끝나고 아 끝난거야? 라고 느꼈으니 좀 허무함  
6,초반은 그냥저냥 대충코미디 중후반은 호러물 마지막은 반전도없고 관객에 맞긴다는 무책힘하고 비논리적결말ㅠㅠ 그래도 시간때우기는 좋을듯 기존작품에 비해 그저그런데 연기자들의 연기력은 인정  
7,몰입도는 굉장한데 이건 뭐지 생각드는 느낌...  
5,괴기스럽기까지한 ~기빨리는 영화예요  
7,다른건 몰라도 굿씬은 좋았다  
6,놀래키고 긴장되고 볼만하지만 보고나면 찝찝한 영화  
5,스트레스 풀러 갔다가 받고 왔다.  
5,제스타일은 아니네요..  
6,보는내내진빠져죽는줄 칸만아녔음 안봄  
2,순간순간적인 몰입도나 연출만 있을뿐.스토리는 엉망진창  
5,Good good good  
6,넘기대하고 가서 보았지만 생각만큼 반전이 일어나진 않은것같았습니다  
7,자~알 봤습니다  많은 이야기를 듣고 간 상태라   그런가 전개 부분이 쫌 지루 햇어요  
3,저는 귀신그런건줄몰랐는데 ... 암튼 재밌어요!!  
6,복잡하고 찜찜한 영화..  
10,돈주고 스트레스받는데 볼만한 영화두번은 봐야되는영화  
10,결과는알았지만 반전이있름  
10,재미짐. 열린결말이라 상상력이좋은사람일수록 재미질듯  
10,와우잘봤어요대박입니다  
10,반전꿀잼이었음 굳굳굳재미잏음  
10,재밌어오 긴장감 대박 짱짱맨  
10,진짜 오래간만에 소름돋을 정도로 재미나게봤다  
7,잘 만들어진 영화란 생각이듭니다 긴장감도 연출도 ㅎㅎ 코믹요소들도 - 하지만 결론적으론 영화가 뭘 얘기하고 싶은지 와닿지않아서 아쉬웠습니다  
5,ㅎㅎ 재미있는거같으면서 아닌 것 같은 보는동안은 무서웠지만 보고나선 이게 머야 하는 느낌!반전에 반전 마지막 결말은 먼가 허무한황정민은  머지????  
6,심야로 봤는데 그냥저냥 봤네요~~  
7,고민하게만드는 오묘한영화  
5,그냥그럭저럭 찝찝하고 재미도 그닥  
7,완전은 아닌데 걍볼만해요~  
3,오픈결말 종류의 영화 완전 싫어함..영화자체는 재밌는데 결말이 저랑 너무 안 맞네요  
7,다보고나서도 엄청 찝찝한 영화!!  
7,곡소리 부르는 사기꾼이 따로없네  
6,믿음에 관한 백화점 같은 영화.  난 지루하고 황당하다.  
8,재밌어요재밋어요재밌어요  
10,처음 만나는 한국 영화 장르..  
10,최고네요 나홍진감독 다음영화도 기대되네요.  
7,계속 생각나요 마지막 장면들이.. 처음으로 영화보고 체해서 토했네요. 멘탈약한 분들 조심하세요  
7,꿈자리사나운영화...  
5,결말이 너무애매함...  
7,무섭고 더럽고 2시간반이 너무 힘들었다  
5,강렬한 빨간 두 눈. 기분이 찝찝긴장감을 처음부터 끝까지 유지시키는 힘만 대단.  
5,먼가 여운이 남는 영화는 아닌것같다  
10,누가 귀신이양? ㅜㅜ 황정민도 귀신 씌엿낭?  
10,황정민씨 구싸는장면을감명깊게 봤어요...  
5,나름잼나름잼나름나름  
5,내용에 대해잘모르겠네요 소리만 ㅠ 결말도 ㅠ  
7,마치 좀비영화를 보는듯...결론도 애매하고 뭔가 부족한 느낌?영화를 재미나 흥행위주로 보는 사람이라 그런지 속시원한 통쾌함도 없고 감동도 없고... 흠  
4,영화는 잘 만들었는데...설명이 너무 부족한느낌  
5,기대를 너무하지마요....이도저도 아닌..머 초반에 웃기고 아역연기에 놀라고 끝  
9,결말이좀 아십네요스토리이해안됨  
9,보는내내 지루한건없었다반전도있었고 스릴있고 쫄깃한 영화였다  
8,러닝타임이 상당히 길었다는걸 영화가 끝나고나서야 알았다  
9,호불호가 넘 심해서 정말 궁금해서 봤어요 전 불호.. 왜 15세인지 모르겠어요~~  
7,연기는 좋으나 반전에대한 복선이 없어서 너무 밑도끝도없는 느낌  
7,흠... 뭐지 악마..? 왜?  
2,중간까진 볼만한영화... 한국영화는 보고나면 시시하거나 결말이어의가없드라....  
6,너무기대를 했나봐ㅠㅠ  
9,신선하네요 내용이! 영화보는내내 무섭지 않았은데 집와서 생각하면 무서운양화!!  
10,재밌음 재밌음재밌음재밌음  
3,추천하기에는 심신이 좋지않다  
10,절대로 속지마라 절대로  
9,곽도원의연기가볼만하네요~긴시간임에도지루하지않게본영화입니다.결말이어떤내용인지는관객이판단할내용같아요~~  
3,전국민 낚시영화. 히치콕이 되고싶었던 감독의 오만함  
9,믿는 순간 그렇게 보인다. 결국 악이란 나의 의심안에서 존재한다.전작들과 달리 잔인함을 직접 드러내지 않아도 얼마나 잔인할 수있는지를 표현해낸듯... 짱.  
9,해석한거보니.. 영화가 장난아니네요 한번더보고싶어요 전엄청 많이 낚였네요  
10,볼때는 어리둥절했지만 보고나니 다양한 해석을 찾아보게 되는 영화.다시보고 싶은 영화  
9,영화보는 내내 긴장감에 손에 땀이 났다.나홍진 감독 연출력 기가 막히다  
5,우리나라 최초 좀비영화인듯~~4885를 넘 인상깊게  봣는데  이건 아니지 싶은데~~  
6,내용이해는 좀 어렵네요하지만 황정민 곽도원의 연기는 역시 최고네요~~~매력포텐터진 곽도원 좋습니다~~~  
6, 긴장감있었지만 개연성부족  
5,내용은 진짜좋았는데 표현을 하지못하는 느낌결말도 아쉬웠고 별로 무섭지도않았다특히 콩트를보는건지 영화를보는건지 헷갈렸다  
9,어렵지만 흥미진진하네요  
8,재밌어요 ㅋㅋ 근데 저 빠가라서 이해못함  
8,우띠....짜증나....ㅡㅡ 나 혼자 사는데....잠 다잤네ㅡㅡ  
5,열린결말이라고 하지만 맥락을 찾기 어렵다  
5,"반전의 반전이 깊은 영화입니다 황정민 영화는 최고라고 자부했지만, 이번 영화에선...마지막 엔딩도 참으로... 아쉬운 부분이 많은 영화네요...  "
4,해설 안읽으면 이해 안되는 영화  무섭다고해서 봤는데 무섭지도 않고 ....  
6,별로  재미엄다 난해한 내용이라서  
8,내용이 어렵지만 중간중간 숨은 힌트를 찾는다면 재밌습니다~  
6,메세지가 뭔지 모르겠슴  
6,그래서 결론이 머야라는 생각이 드는 영화  
6,영화가 넘 어렵고 힘들었어요 기대이하입니다  
6,시선을 끌긴하는데 뭔가 억지스러운 설정이 드문드문 보임 딱히 뭘 암시하는지도 모르겠고~  
6,시간도잘가고 볼만한데 내용이해가 정확하게안되고 난해하네요 아무튼 잘봤습니다  
5,내용이 잘.. 이해가 안가고 그냥 무섭네요..  
10,굿 두번봐도 재미가있네요  
8,재미있음 ㅋ 관객에게 판단하게 하는 영화  
10,다음이 기대되는 웰메이드 천우희 만세  
10,후회안함10101잉10  
9,간만에 재미있게 봤음.  
10,소름~~중반부터 끝나고 돌아올때까지 소름이... 정말 재미있게 봤습니다ㅎ  
10,"흥미진진하고 재밌는데, 다보고나서 이거뭐지?  "
3,그날이후 잠못잠ㅜ 종류별 공포의 집대성.스릴과 의문은 덤.  
9,오지게 잘만들는데 딱 하나 단점은 보고나서 기분이 별로 좋지 않다는 것이다  
10,나홍진 감독은 정말... 무시무시하다... 아직까지 영화가 잊혀지지않는다.. 참고로 2번보니 느낌이 더 다르다 영화의 장면장면 하나하나 의도가 느껴지는게 나홍진감독님은 변태닼ㅋㅋ  
8,오랜만에 보는 여운이 남는 공포영화!!  
10,곱씹게 되는 영화. 효진아ㅜㅜ  
10,또봤음ㅋㅋ 재밌어요!!!!  
9,무서웠지만 재미도있고 끝까지 긴장감있어요  
10,돈이아깝지않은영화!  
8,신이든 악마든 내가 믿으면 존재하지만 안믿으면 상관없음.결국엔 모든것이 믿음으로 나오고 의미없다는 결론을 위해 한장면한장면에 의미가 부여된다  
6,영화가 끝나고 영화풀이를  찾아보고 읽어봐야지 영화의 마무리가된다  
5,연기면 연기. BGM 스토리까지 좋은데 보고나서 오히려 더 답답하고 애매해지는 영화.보고 후회는 안되는데 왜 봤지 고민하게 하는영화  
8,지루할틈없이재미있었어요~  
9,너무 무서워요....  
9,재미뜸 진짜 스토리 잘만듬  
10,구성이 체계적인 영화였다~  
10,굿정말소름이오소소소슈소  
10,아....다시보고싶다  
10,작품의 스토리완성도 높음  
4,뭐야..? 음...무슨말을 적어야할까....  
8,긴장감이 상당한 영화 한국형 오컬트 무비  
10,재미나요꼭봐요진짜루  
8,결론이 예매모한게 아쉽네요  
2,'그사세'라는 느낌의 영화  
7,내용은어렵지만볼만한내용이였어요!꼬마연기가최고네요!  
10,완전 재밌고 다시 보고싶음  
8,잼있게잘봤습니다정답없는 영화ㅎㅎ  
8,의심으로 시작되어 의심의로 끝나는 그리하여 곡소리만난무하고 설득력이없는다소 산만 하고 실소를금치못하는 어이없는 장면까지 ㅠ모든종교들의 집합이네요  
5,재밋는데범인을아직모르겟어요ㅜ  
5,무슨내용인지 뒷부분에 반전만가득..  
7,결말이...열린결말은 별로에요  
4,전체적으로 영화가 괜찮았는데 아쉬운 부분들이잇네요영화를 다시본다면 더 괜찮을거 가타요  
9,"영화는 시작부터 끝까지 재미있고, 지루하지않았지만 멘탈관리가참 힘든듯  "
8,재밌게 봤어요!~!!!  
10,추격자 황해 너무 재미있게봐서 이번영화도 기대하고있었는데 정말 2시간넘게 잠시도 눈을 떼지 못하겠더군요 정말 최고입니다  
10,도대체 뭐가 복잡하다는 건지.  
8,무척 재미있었다가  결말쯤 가니 그저 그랬음..  
5,너무 잔인해서 반은 못봤어요  
3,사실 잘 모르겠다...재밌는지...  
10,올해 최고의 영화 !  스토리 연기 어느것하나 빠지지않고 훌륭함  
10,올드 보이 이후 명작의 탄생  
10,두번 보세요 한번은 아닌것같아요  
8,"보는 내내 쫄깃, 개연성에 아쉬운 부분 있음  "
9,"믿음없는 세상의 허무함과 그틈을 노리는 사단의 역사,그래도 구원이 있으리라는 오픈결말이  좋았습니다  "
8,결말이 쫌 난해하긴했는대  그래도 재밌어요..오늘밤 잠 못잘듯ㅠㅠ  
10,오걸트와 반전 좋아하시는분 꼭 보세요  
8,무섭지만 다시한번 보고싶네요~내용이 이해가 안되는부분도 있어요.효진이 연기 정말 잘해요^^  
7,아리까리ㄲ까리 하지만 황정민 멋있다  
5,마지막이 너무 아쉽네요결말두 없이 너무 허전한게 참 아쉽습니다  
6,재미있지만 난해한 이영화....  
6,연기자의 연기는 좋았지만왠지 끝이~~ㅋ이게뭐야라는말이 나오는데요~^^  
8,절대 현혹되지 말라고 포스터에도 써있다. 영화 내용 미리 조금이라도 보지 않는것을 추천한다.  
10,진짜보는내내 소름돋아머요 꿀잼  
8,지루하지않고 긴장감 줬던 영화네요 ~~ !!  
8,좋아요 그런더 쫌 아쉬운건 잇네요  
10,2시간30분 처럼 느껴지지않고 진짜 재밌게봄  
9,마지막이 너무 아쉬워서..  
8,연기력은진짜ㅠ짱 무섭기두하구..요새들어 한국영화소름끼치게만듬 ㅠㅠ  
8,내것을 지키고자하는 인간의 이기심이 가장 공포스럽다.  
9,볼만했음. 다만 해석은 분분할든  
9,역시 믿고보는 감독과 배우들 재밌었요  
7,영화 보고 나오는데 무슨 내용인지 이해못한 사람들이 많음 ㅋㅋ  
9,누가 범인이냐가 중요한 영화가 아니다  
8,결국 평범한 닝겐이 할 수 있는건 아무것도 없었따  
7,다른평들에 끝이허무하다는글이 많았는데요  정말그렇네요 끝난건지안끝난건지 허무하네요 영화는 참재미있슴^^  
