star,comment9,영화를 보다가 의문을 결코 방관하지 마시길. 당신의 혼돈은 그 순간부터 시작될지이니.  
6,사람들이 왜 보고나서 찝찝하다는지 알듯하다. .내내 긴장되서. .긴장감은 최고ㅋ  
7,무서웟어요 19세인줄알앗어요...  
7,보고나서 뭐지 헐.... 이런... 보고나면 공포보다는 의아심이 더 드는...  
7,골룸이 나타났다~!!!  
5,볼만하다~~첨부터끝까지긴장감과궁굼증??근데 끝이 영~~찜찜...  
7,재미있었음..결말이이해가 잘안가서 스포일러 확인해봄.  
5,저한테는 조금 어려운 영화였네요..  
7,조금 불편한 영화네요ㅠㅠ  
9,첨엔 웃기다가 후반부 몰입도 최강 후 반전에 반전 쵝오  
9,한국형 육감(식스센스)을 본 듯한 기분...소름끼침~  
10,"굿,,재밋음ㅎㅎ한번으로는해하기어려울수도  "
10,재밌게밧어요  잘만든영화  
9,OO아쉽네요 그래도 구점  
10,영화관을 나와서 더 소름이 오는 영화!  
8,징그러운 장면이 많아서 15세인게 의문..ㅋㅋㅋㅋ그래도 영화몰입도랑 내용은 최고인듯...  
9,잘만들어진 영화! 연기를 너무잘했다..  
10,반전에  반전  대박추천합니다  
9,중3 딸아이가 보자고 해서 봤는데  난 그냥 그냥 그랬다  
8,간만에 짜릿한 영화를 보앗다  
8,결말이 조금 애매하긴 했지만 재밋었어요!  
6,시간만큼 지루하진 않았은데 그렇다고 소문처럼 긴장감이라던지 보고나서 꿈에나올까 무섭다느니 그런건 없네요 . 아 물론 저랑 여자친구 둘다요볼만은합니다 ㅎ  
5,동서양 빰뽕 엑소시즘. 악의 존재를 우리정서에 크게 와닿지 않는..어딘가 '서양악마'적으로 표현한 것. 반면에 그 배경과 인물들은 굉장히 향토적이였는다는 점에서 매우 발란스가 안맞는다고 생각함.  
6,처음부터 끝까지 이상해 이상해 이상해  
10,절대로현혹되지마소잉  
9,굳!!이해가안되긴안되내요ㅜㅜ제가이해를못하는건지...?ㅜ  
4,음. 뭐라 설명할수가 없다 ㅜ ㅜ 결말도 ..  
3,무섭고 별로엿어요 ㅠㅠ  
9,무당과의 싸움인 줄 알았더니... 현실에서 사람처럼 자연히 느끼지 못하는 존재들끼리의 관계가 있어서 재밌었습니다  
6,"마지막으로 갈수록 영화가 담은 주제가 어떤 것인지 알 수 있다. 그러나 그 이해가 사고의 확장으로 이어지는, 인간을 돌아보게 하는 내용인지는... 아쉬움이 남는 영화  "
8,그냥 재미는 있었지만 결론이 애매하게 끝나서 좀 그랬습니다  
8,결말이좀 그렇지만 재밋음  
7,월광이 오히려 악당인건 굿하는순간부터 이해했는데 일본인이 악마의 모습까지 갖추고 차에치어 낭떠러지에 버려지기까지했어도 살아날 정도인데 산절벽씬에서 마치 사람인것마냥 묘사된게 이해가안된다. 요즘 본 영화중 퀄리티는 뛰어났는데 겁나 뒤가 찜찜한영화임.  
7,감독이 무슨말을 하는지 잘 모르겠다.... 하지만 몰입도만큼은 대단한 영화!  
8,뭔가결말이 찝찝함악마가누군지 알아내라이건데ㅋ  
7,끝까지 농락당한 느낌 끝까지 농락당한 느낌끝까지 농락당한 느낌  
8,백만 관객 저마다 백만개의 이야기를 만드는 영화  
7,재밌게 봤고 한가지 꼬마애가 넘  힘들어보였어요.연기도  잘하고..  
10,아주 야무집니다 꼭보로가세요  
9,정신없이 무섭다....  
10,진짜 개대박 아직 머리에 맴돔 ㅠ  
10,지릴뻔.. 너무너무 너어무 무서운데 영화가 안끝남ㅠㅠㅠ  
8,깜짝깜짝 놀라게 하는 장면들이 없는건 아니지만 그걸 제외하고도 음산한 분위기자체를 잘 조성하여서 공포감이 충분히 드는 영화였습니다  
6,빗길운전조심해야함...  
8,영화는 잘 만들었으나 장르물이라 호불호가 갈립니다  
8,마지막  일본인과  부제와의 대화가 기억에 가장 남는다 .끝나고 나서 더 생각나는 영화  
9,잔인한 장면도 많았지만 보는내내 스릴감있게 봤습니다  명배우들과 아역배우의 연기도 좋았고 반전에 반전이였습니다  
10,허..개잼 꿀잼 최근 3달간 본 영화 중 최고의 영화인듯 ㄷㄷㄷ  
6,무섭지도않고 결말도 이상하고..괜히 봤다는 생각뿐  
7,함부로의심하면안됩니다  
8,이게 왜 15입니까 ㅜㅠ 28로 해야합니당..  
7,역시 연기는 굿이다 소름끼치긴하지만 반전있고 또한 사람을 너무 의심하면 안댄다는점...  
7,퍼즐을 맞추는 느낌이랄까?영화가 끝나고 허무한 느낌...뭐야~?  
9,기대치 보다 재미있고 흥미진진하게 보았어요.  
10,완전대박.영화보는내내.긴장  
10,영화 곡성 재밌고 무섭게 잘 봤습니다  
10,ㅎㅎ....쩌네여...  
10,재밌어요 완전 추천!!!  
10,재밌다.. 시간가는줄 몰랐다.. 연기력이 대단했다  
7,영화가 어려움.  앞선 추격자. 황해에 비하면 기승전결이 흐리고 해석의 폭도 넓고... 이런 영적 주제에 관심없으면 지루할수 있음.대중성보다는 작가주의적 문제성 있는 영화!  
9,기대랬던 만큼의  영화. 긴 시간임에도 적어도 지루하지 않았던  영화. 곽도원  배우의  연기는 리얼.숨가쁘게  펼쳐진  후반부의  상황에  대해  곱씹어봐야겠다. 근데  15세  관람가  맞음???  
7,왜 15세인지 노이해 지만 나는 잼깨 봄 ^^*  
10,개연성없다고 1점준사람들은 다시한번 꼼꼼히 인물말고 다른것들을 꼼꼼히 보시길.  
9,완젼지렸음...분위기 최고  
8,보고나니 진이 빠지는 느낌  
10,걍 최고 걍 최고 걍 최고 걍 최고 걍 최고  
10,재밌네요 하하하하 ㄴ 있다 있는  
9,비현실적인 현실감만 남는영화  
9,와 올해최고의 영화입니다!!강추!!  
8,스토리 연기 모두 괜찮았다이런류 대부븐 왜?라는 시작점이  궁금하지만 다른 나라의 b급류 내용을 a급으로 잘만든 영화란 생각이든다  
8,페북에서그난리날정도는아님  
10,와... 믿고보는 영화네요...  
10,재미있고 스릴있었음ㄷㄷ  
10,심오한내용이라서 보기좋았음  
5,재밌는거갗기도하고 아닌거같기도하고  
6,무슨내용인지 잘이해가ㅠㅜ  
7,팬티가답인것같다 아....  
5,이거야말로 어이가 없네 ..?  
10,관람후기 보고가면 안되는 영화  
9,재미있게 받습니다...내용이  
10,제가 봤던 이런 장르 영화중에 최고  
10,관객 속이기의  환타지 호러무비연기력은   아꾸다(?)가  짱~~^^  
6,영화 보면서 계속 뭐지?뭐지?얘기하고자하는게 뭐지? 기대하고봣는데 나올때 관람객들 다들 뭐야?라는 반응  
10,천우희짱임 연기력장난아녀  
10,재미 있음 ㅎ믿고보는 곽도원  
10,간만에 영화다운 영화 봤습니다. 강추입니다!  
8,관객을 헷갈리게. 한참을 생각을 정리하게 만드는 영화  
10,지한테 재미없었다고 평론가들을 욕할이유는 없지않음?? 이영화만큼 창조적으로 한국식으로 해석해낸 오컬트영화 지금까지 없었을걸??? 정말 창조적임... 새롭고.... 영화적체험하고싶다면 보고. 정답맞추듯이 공부하듯이 볼거라면 보지마 걍  
10,영화 중간중간 계속 심증이 나올때마다 의심하고 의심했지만 막이 내리고 난 후 아. 아무도 믿을수가 없다 라고 생각하게 되었습니다. 감독한테 완전히 현혹되어 버렸고. 2시간 30분동안 크게 재미있다는 생각 안했는데 막이 내리고 인생영화가 되었어요.  
10,환장하겠습니다 생각이 많아지고 한장면 한장면 다 해석 해야한다  
10,그냥 보세요. 꼭 보세요.  
9,찝찝 떨떠름 소름 이상 생각 복잡  
10,"간단명료한 스토리, 시원시원한 액션을 원한다면 시빌워를 보러가세요^-^  "
10,처음부터 끝까지 눈을 뗄수가 없었어요.  
10,찝찝한 영화지만 재밌네요  
10,졸잼 개무섭 썅 쪼들림 소름끼침  
10,좋아요진짜넘나스릴쩔어요  
8,영화 평이 안좋아 망설였는데만족하고 왔네요.영화를 보이는대로만 보는 사람들이 평을 다는구나 생각이들어요.의미부여가 되는 영화 였어요.  
10,자꾸 봐서 다 해석해보고싶다  
8,시간가는 줄 모르고 봤어요~무엇을 이야기하고자 하는지 정확한 이해가 어려워서 인터넷에 검색 해봤네요ㅎㅎ  
10,재밌어요 보고나면 찝찝하지만 추리하는맛이있음  
10,재밌습니다재밌구말구  
10,아역연기 쩐다천우희 짱!  
9,초반은 흥미있는데... 후반에 그저그랬음  
10,짱 재미있어요 ㅠㅠ 무섭기도했지만 결말이 좀...그래요  
8,첨엔 후덜덜 무서웠지만 마지막 장면은 너무 허무하게 끝나서 조금은 아쉽긴 하지만 그래도 장면 부분 나올때마다 스릴있고 긴장을주는 영화네요~  
10,치밀하게 잘 구성하여 나와서 토론나누게 하는데다 실제존재하는 악마를 잘다루었어요  
10,"곡성 인기가 많아 미리 예매하고 영화를 봤네요.곡성 전,  미리 해석보고 가도 이해가  부족해서,다시 영화 분석한후 마무리했네요.스릴감은 최곱니다. 이해전달은. . 글쎄요.  "
8,재미있었습니다. 중간중간 무서워요  
10,그냥 존잼...ㅜㅜ무서웟는데 재밋엇음  
8,연출이 너무 맘에 들고 무엇보다 딸내미의.연기에 황정민 곽도원이 신경이 묻혀버릴정도였다. 하...근데 말장난 너무 마니 치네 뭐여 결론이 ㅡㅡ  
10,몰입감이.... 예고편이 다라고 생각하면 오산  
10,황정민 너무 멋있어요 짱짱짱  
10,영화를 곱씹을수록 잘만든 영화라 생각듭니다내용을 이해하고 한번더 보면 더 좋을거라 생각됩니다 정말 감독의 낚시에 제가 걸려든것 같았어요 마지막까지요  
10,상영시간을 잊을만큼 긴장감 최고!!  
10,한번 더 보러 가야겠음!!  
6,관객들에게 너무 많은 이해력을 요구하신거 같네요  
3,극의 전개는 좋았으나 결론이  너무 허무 맹랑했다.  
5,음..좀비영화냐..머 할말이 엄따  
6,설명이 불친절한 내용 같아요결말도 너무 열린 결말이라 당황스러웠습니다  
8,재밌습니다~볼만합니딘  
10,개잼있다 또봐야지 ㅋㅋ  
7,곡성의 가장 큰 적은 기대...  
9,이결말은 뭔가요~어쩌라구요ㅠ결론을 말해줘야지~~~~!!  
7,너무 어려워요 해석하기가 ㅠ ㅠ  
9,재미있었습니다 반전에반전애 반전에 반전에 반전에 모가 진실이죠?  
7,배우보고봣는데 기대이상입니다  
7,저는그냥칠점정도드립니다.  
9,17금정도! 심적 무장하고 가서 그런가? 그다지 역겨운 건 모르겠고...역시 나홍진감독! 롤러코스터급 재미! 결말은 의견이 분분할듯!  
9,배경 지식이 부족해서인지.. 좀 난해했습니다.  
8,반전에 반전~ 결말 예측불허~ 근데 본 사람들 대다수가 뭔가 허전한 결말이라고~^^ 암튼 재미있었어요~^^  
8,첨볼때 너무무서웠어서 공포한번더 느낄려고 한번더봤는데 노잼  
9,스포당하고 봤지만 최고였다  
6,배우들 연기는최고내용은 모르겠어요ㅠ  
5,졸라개찝찝 스토리연계도안되고무섭지도않고ㅡㅡ  
5,등장 인물에 정체를 알수가 없네 ㅋㅋㅋ  
5,"기술적으론 스릴러의 교과서라고 생각한다. 허나, 이야기면에서는 말을 하고 싶지 않다.  "
8,사람들의 반응에 비해서 기대에 덜 부응했다  
8,재미있음 무서운장면 자꾸떠오름  
10,나름볼만함함만볼름나  
10,"보는 내내 닭살~~~너무 무서웠어요 연출 ,연기 최고최고 마지막끝나고 나면 꼭 대화를 나누고 서로 자기의 생각을 얘기하게되는 영화에요~보는이에 따라서 다르게 느낄수 있는...재미나게 잘봤어요 강추합니다  "
8,"흐르듯 보다보니 끝났고, 마지막 장면을 보고나니 그 전의 영상을 되짚게되고 !!!! 생각지 못했던 반전. 다만 영화보면서 계속 놀람 ㅠㅠ 아이의 연기가 정말 소름끼침  "
10,조마조마하고 너무스릴잇음 꿀잼  
9,재밌긴 하네요 뭐 돈은 아깝지않았어요  
9,친구랑 잘 보고왔습니다~  
9,볼만함!나중에 한번 더 봐야겠음!  
7,중간중간 웃기도하고 스릴잇어서 놀래기도했는데 후반부에너무허무하고 결말도 썩....그렇다  
8,결말에  응? 하는 순간 영화끝남. 생각이 많아지는 영화  
8,무섭고 긴장감있는데 내용이 완벽히 이해하기 어려워요.  
7,영화가 끝나자마자 질문이 끊이지 않는다. 혼란스럽다.  
8,곽도원 연기 너무 좋았구요  딸 효진역도 박소담 뺨치는 연기. 다만  결말에 당황  마지막 동굴씬 황당  배우들 연기보고  평점드립니다.  
9,무서워요 집갈때 헛것이 보이는 영화!!!! 무서워 무사  
9,최고다 병맛같은 미친영화  
10,절대 현혹되지 마라..강렬한 한 마디  
4,....좀비가코메디  
10,정말재미있게봤어요 한국영화 굿  
2,별 내용 없는 졸작입니다  
5,남들은 수준이 있다고들 하지만 내겐 상당히 맞지않는다는 느낌을 준 영화다. 새삼 현대에 귀신이야기도 그렇고 너무 잔혹해서 불쾌하기까지 했다 영화 본 걸  후회한다  
8,스포당했는데도  겁나재밋게봣듬..  
7,음... 사람들 해석 안보면 7점... 중간에 b급영화적 요소도 있고  감독이 자기만족을 위해 만든 영화같다는 느낌이 강했어요.혼자 장황하게 만들어놓고 반전 유도를 전혀 못하게 한다음에 반전이라치고 내보낸것 같은 느낌 관객이해를 중요치 않게 상각한듯  
5,지루하고 내돈내놔요~~  
8,재밋게봤습니다 또봐도재밋을듯  
10,소름의 연속 반전에 반전 최고  
6,15세   관람가가  아닌  영화같았고  생각보다  징그러운  부분과  놀라는  부분이  많아서  별로였다  단지  과학으로  풀  수  없는  무속의  세계를  보고  싶었는데  말이다  
8,이정도면 수작입니다.. 뻔한 한국영화의 틀을 깨준 영화  
10,봤던 한국영화중에 요런느낌의 영화는 처음이였어요  
1,정말무서워서지금잠도못자요  
10,최근 본 영화중 최고 짱짱  
8,오랜만에 나온 대박 한국영화  
8,런닝 타임은 길지만 집중이 되는 영화  
9,난 미끼를 물어 버렸고..  
10,너무재밌네요 이런평가가 뭐시중헌디  
5,황정민의 연기는 좋았다 하지만 감독의 해석 없이는 이해하기 힘든 영화이다  
9,결말알고 봤는데도 재밌어요  
3,너무 무섭고 징그러워요  
5,하나도 안 무섭다 새로운 소재여서 신선했으나 무슨 얘기를 하려고 하는지 모르겠다. 하지만 배우들연기는 너무 잘한다  
9,이건 한번 봐서는 다 이해할 수 없는 영화 같아요.기회되면 한번 더 볼 예정입니다.^^  
10,그동안 한국영화는 그냥 오락영화고 세계적이다라는 말은 못들었을듯 곡성은 뭔가 우리나라영화 같지 않은...세계적으로도 손꼽히는 미스터리 수작 영화일듯  
10,별점이 뭣이 중헌디 뭐시 중허냐고  
5,괜히봤어 돈아깝고 시간아깝고  
4,저는 결말이 별로예요~  
9,짜증나게 재밌었어요 무삭제판 안나오려나ㅠㅠ  
5,배우들의 연기력..특히 효진이역인 아역배우가 잘했으나스토리는 다소....  
10, 나홍진 감독은 OO 천재다!!!그냥 역대급이다 진짜... 두시간째 와이프와 토론중..극장가서 3번봐도 될만한 영화임  
9,유일하게 아쉬운점은 관객의 상상력을 너무 극대화하고자 한 나머지 이어지지않는 부분이 잇엇는데 이건 스토리의문제가아니라 연출로인한 통편집임을 알고 그냥 편집을 하지않앗으면 어떨까 하는 아쉬움에 1점을 내렷다  
2,그냥 .. 별로 였어요  그랬어요  
2,영화의 80% : 큰 소리와 갑작스러운 스크린 무빙으로 사람들 놀래키기/ 영화의 10% : 배우들의 연기력으로 내용의 엉뚱함과 빈곤함을 그나마 커버/ 영화의 마지막 10% : '앞뒤 전개가 하나도 안 맞는 이게 도대체 무슨 내용일까?'를 생각하며 감상  
9,다들 나올때 한숨쉬면서 나오던데 저도 마찬가지임 진짜 더럽게 재미있는 영화였음 중간에 숨은 쉬게 해주세요 물먹기도 미안할정도였음  
4,그냥 뭘 본건지 모르겠다...  
3,개연성 부족으로 영화 끝나면서 부터 머릿속이 퍼즐맞추기로 바빠지는 영화...  
5, 그냥 평범.. 전설의고향 보는느낌...  
5,뭐가그렇게 재밌던가요 전모르겠네요  
6,이도저도아닌  그저피비린내만 내고끝을내다니..믿는대로 생각한대로..  
6,결말이 뭔가 부족하다 그리고 내용전개도 부족  
4,후기보면 아...그렇구나 싶은데 보는내내 찝찝한기분을 지울수가없음  
5,그냥 자극적인 장면들을 총 집합해 놓았다는 느낌이랄까 무엇을 나타내려고 했는지 감독의 의도가 뭔지 모르겠다  
6,스토리가 이해가 안되고 살짝 지루함  
3,쿠니무라준 연기력이 좋아서 진짜 후하게 3점 드립니다  
3,"별로네요, 스토리도 이상하고 결론이 없어요  "
5,연기력은 좋은데..별로였음..좀 지루..  
6,내용이 잘 이해되지 않는다.  
3,보고나서 기분이 별로 좋지 않은 영화네요..  
3,인기많은데 개인적으로 그닥. .  
5,너무 찝찝했습니다 먼저 던져준 떡밥도 결과고 너무 답답합니다  
4,무작정 소리만 지르는 걸 요즘은 '열연' 이라 표현하는가보다  
10,부모님이 2번보신 영화  
2,무서워요 잔인해요 눈가리고 아무것도 못봤네요 ㅠㅠ  
7,결론도없고내용도  부실한   영화 입니다  
2,무슨내용인지 이해가 잘안되네  
4,음.... 뭐지?? ㅋㅋㅋㅋ 연기력은인정  
5,흠...생각의 여지가 많지만 연결고리가 뭔가 맞지않는 느낌입니다. 독특한 소재는 나름 신선했고 악마는 종교적 신앙에 대한 우리마음의 거울을 비추는것같습니다.여튼 주인공 좀 짜증남  
6,이해가안가는 부분이많았음  
7,대체적으로 긴장감과  결론의해석을  암시를  찾아보는  재미에  간만에 푹 느꼈네요 . 꼬맹이  연기에  소름이돋기도하고 주먹도 불끈 지게하네요 ㅎㅎ 좀비가 갑짜기나타나  당황도했습니다 이것이 마이너스가 아닐까??생각합니다잘 봤습니다  
8,"감동은 없으나 여운이 남는 영화.개별적인 배우들의 연기는 훌륭하지만, 뭔가 배역들이 다소 아쉬운 느낌.  "
5,나는재미없었어요..  
10,어떤영화인지 모르고봤다 이해가 안가는부분도있고 보고난 후 결말해석 보시면 깔끔할듯  
10,이해만 한다면 정말 재밌는 영화인듯하다  
8,여운은계속남는대 이해하기가쉽지만은않네요  
2,기승전결중 기가 없다....주제가 뭔지 모르겠음  
3,잘 만든 영화입니다. 연기도 흠잡을 데 없어요. 하지만 보진 마세요. 정신건강에 해롭습니다.  
5,그냥 애매합니다 처음에는 재밌다가 그좀비씬에서 노잼되고 마지막에 정체밝히는과정이 집중안되고 너무심오해요  
7,어린아이의 연기가 정말 인상깊었음  
5,답이 안나오는 영화 한단어로 노답  
8,정말뭘말하려고하는지모르겟어요...  
5,감독이 겉멋들어 스토리망친케이스  
7,집중도는 최고. 의심 갈등 반전 소름.  
8,잼있습니당 심장 쫄깃쫄깃  
10,종홍나 무서웤ㅅ어요 시봥 진짜 잠을 못자겠네 시봐 아오 ㅅ바 ㅈㄴ짜 욕나올정도로 무서움 ㅠㅠ  
10,谷城이 아니라 哭聲. 개봉일에 보고 여태까지 생각남. 잘 만든 영화.  
2,마지막 마무리가 마음에안드네요..ㅎㅎ  
6,배우들연기늠좋았닷 하지만 내용이 그리탄탄하진않음  
10,뭘 봤는지 모르겠다. 한 두번 더 봐야할듯.   근데 뭔가 지금 헬조선과 비슷한 분위기.  누가 선인가. 진정 내편은 누구인가. 왜 이런 일이 일어났는지도 모르겠지만 어떻게 해야 살아남는가.  
10,사진기 귀신 황정민 짜세  
5,믿어라. 교훈이고 남는건 배우들 연기네요. 엔딩크레딧 올라가고나니 왠지 감독한테 우롱당한 느낌 때문에 찝찝하네요.  
2,"뭔가 성서 구절을 통해 말하고 싶은게 있었던 것 같았는데, 벌려 놓기만하고 회수하지 않은 혹은 방치한 복선들 때문에 집중하기 힘들었다. 무엇보다 인과관계에 굉장히 비약이 많고 과장과 산만함 때문에 보기 힘들었다  "
5,영화는 영화니까 비현실적이긴 하지만 중간에 차에서는... 꼭 그장면이 필요했으까 싶네요...  
9,시작부터 끝까지 긴장감을 놓칠수 없었던 영화.  
10,전혀 지루하지 않은...!  
10,오랜만에 끝까지집중한영화..  
4,몇년만에 영화관서 본 영화인데... 소문만 듣고 내용 모르고 갔다가 .. 된통 당함. 나는 별로였음. 별로임. 만드신다고 고생은 하셨겠고 재미도없는건 아니지만..보는내내 스트레스...  
8,알아보면재밋는영화!!!  
10,영화가 끝나도 계속 머리에 맴도는 영화  
10,영화는 탄탄하고 재미있는데 해석하느라 머리가 아파요..  
10,무섭뭡섭 ㅠㅠㅠㅠ정마류  
9,다들 연기력이 소름돋네요 내용전개가 2프로가 아쉽습니다  
8,몰입도는 좋았는데 두번은 봐야 이해 할수있을거같다 ㅡㅡㅋ  
10,의문이들어요  어려워요  
9,"계속되는 긴장감,그리고 반전~강추합니다.  "
9,으 더티더티해 하지만 볼만함  
7,어렵긴 하지만 생각하는 재미가 있네요  
9,천우희예쁘다!!!!  
9,마지막에 결말 이해 잘안되찌만 생각하면서 결말이 이해되는 뭔가 천재스러운 영화같음ㅋㅋㅋ  
8,재미있었는데 결말이 조금 이해가 안됐어요 ..ㅠ  
9,재미있게 잘봤어요~~^^  
9,진짜 오랜만에 영화 처음부터 끝까지 집중하면서 봤습니다b  
7,끝까지 몰입하게 만드는 전개 그리고 필요없는 잔인함  
8,진짜재밌었어요!강추!  
9,징그러운 장면이 너무 많이 나와서 보기가 힘들었지만 내용은 반전도 있고 재미있었어요ㅎㅎㅎㅎ  
7,도무지 결말이 뭔지??  
8,간만에 스릴러 꿀잼...  
8,호불호가 갈릴 수 있단 이야긴 들었지만 걱정했던거 보다 더 재밌게 봤습니다  
8,재미있으나 지인에게 추천해주고 싶지는 않은영화  
10,몰입도 장난아니에요!!  
10,짱이다유짱이다유~~~~  
10,긴장감을 늦출 수 없고 지루할 틈이 었었다.한국에 맞는 소재의 호러 어드벤쳐영화로 신선하고 새로웠다.  
10,"""'의심'하지마라...""   영화가 끝나고 마지막 부제의 모습이 마치 자신을 보는거 같았다 영화를 보는 내내 아니겠지, 아닐거야, 설마, 하면서 한편으로는 점점 의심을 믿고있는 내가 있었다  "
10,좀 이해하기 어렵지만 잼나영  
8,결말을 알기에는 좀난해하지만 재밌네요  
3,이상이상....ㅏㅏ  
10,생각 많아지게 하는 그언 영화네요. 정말 재미있게 봤습니다.  
8,연기력 짱~ 정말 신들린연기~ 근데 좀비는 뭐죠?  
7,한국영화에 이런 스릴러가 나왔다는거에 감탄했다 배우들도 역할에 맞게 다양한 연기를 잘 소화하여 몰입도가 좋았다 하지만 관객들이 이해하기에 쉽지않은 내용이었던것 같다  
9,내용이 심오하고 조금 어렵지만  한국영화에비해  최고인듯 ㅎ 재밋게잘봣습니당  
8,한번봐서는 이해가 힘든영화 또 봐야지  
7,무섭다. 찝찝하다. 어렵다.  
10,역시 나홍진호불호 갈린댔지만 보는내내 긴장감과 스릴 최고  
6,애매모호. . . 연기력들은 죽임..  
6,가나다라마바사아자차카타파하  
5,음 뭔가 결말이 상당히 아쉬운거 같네요긴장되고 스릴 장면이 몇 있기는 햇는데. 결말에서 다 깎아 먹은듯한. 허무함으로 끝난 영화입니다.  
8,쩔었음....천우희가 돌던지는거 미끼물지말라고....도망가라고ㅠ.ㅠ  
6,상영시간이 너무 길어서 힘들었음 결말도 너무 마무리가 안된느낌 ㅜㅜ  
10,한국판 좀비~~ㅋ마무리가 애매했지만 꿀잼~~~  
2,지루하고 너무 오바하는듯한느낌..  
5,내용을 이해하기 어력고 재미 업서요  
7,마무리가 왠지 허전해요  
7,"15세 관 람인데  애들하구 보기엔 아닌거 같네요,내용도 잘 몰겧구.?  "
