star,comment9,페북에 막 노잼이라고 막 그래서 솔직히 기대안했는데전 개인적으로 너무 재미있었어요 연기자분들의 연기는 뭐 말할필요도 없었고 진짜 그냥 최고 근데 별로 무섭지는 않던데요..  
4,그저 그런영화.. 너무 꼬다가 본연의 스토리를 잃은듯 하네요  
10,계속 곱씹게 되는 영화! 엄지척  
10,여운이 남네요~ 몰입도최강입니다  
9,결말이 아쉬웠지만 역시는 역시입니다!  
10,"또하나의 최고의 영화!, 보는 시각에 따라 결말이 달라짐  "
9,장난아니네여 해석하는재미입니다  
9,재밌게 봤습니다ㅎㅎㅎ  
10,반전이네요 재밌어요ㅎ  
9,재미나요여러번 곱씹으며 봐야  
9,심리전 최고..하지만 보고 나니 마음이 무거워지네요ㅠ  
9,처음부터 너무 스릴있고 무서워요 마지막까지..  
10,완전 몰입도짱 보는내내 추리하느라시간가는줄몰랐음다들욕해대서기대를안해서그런지핵잼  
9,개봉하자마자 평점이 뚝 떨어지길래 .. 낚일까봐 보지 않으려다가 오늘 여친과 가서 보고왔습니다! 영화가 끝날때까지 결말을 도통 알 수 없었다가 후기찾아보고 깜짝 놀랐습니다.. 반전에 반전 ! 몰입도 높은 배우들의 연기 ! 전 너무나 재미있게 봤습니다  
6,무겁고 무섭고 무시무시하고.. 연기력은 믿고보는 배우 황정민  
5,자극적인 소재..두시간내내 정신적으로 스트레스 받음 ㅠㅠ..특히 하필 또 아이가 빙의된 장면은 ㅠㅠ소재는 신선하긴했으나.. 너무 자극적이라서 정신건강에 안좋음 ..  
9,기분나쁘게 재밌는 영화  
6,"더폰, 시간이탈자 같이 항암걸리는 영화하지말라는거만 골라서 함  "
5,잔인한장면일때 잠깐무서웠던거말고 그다지 흥미는없던....  
10,재밋엇어요 ㅎㅎ연기 너무 잘함 아역배우까지 완벽  
10,곽도원 최고입니다 연기력 굿  
9,너무 단정지어 보지마시길 바랍니다~  
10,마무리가 생각을 많이 하게 만듭니다  
10,생각을 거듭할 수록 대단한 영화  
10,정말 재밌게 잘 봤습니다....!!!  
5,생각보다 결말이 허무하게 끝난거같아 너무 아쉽습니다  
10,재미있게 봤습니다 한번더  
6,진짜 영화 끝나고 뭔가싶다..  
10,영화 내내 긴장감을 늦출 수 없는 스릴넘치는 잘품입니다  
10,나약하고 또 나약한 인간  
9,와우 개스럴였어요  오래만에 영화다운영화  
5,보고나면 뭔가 어리둥절한 영화  
5,부족한 개연성과 등장인물들의 답답한 전개를 제외한 나머지는 없구나...  
10,정말최고의영화입니다  
10,반전반전반전반전반존  
10,최고입니다 시빌워보다 더  
10,미치도록 재밋다 내생애 최고  
6,기대보다 별로.. 좀비가뜬금없었음.  
5,ㅅㅂ 기분개잡침 ㅡㅡ 이렇게 기분더러운건 오랜만이네  
5,소오름 이해 엑스....  
6,"첨엔 좀 무서웠는데, 갈수록 그냥 좀비물 같아지네요...  "
4,흠.. 머라말할게..  그냥 잔잔한웃음에 결말을 이해할수가없는..  
7,솔직히 무슨내용인지 잘모르겠어요  
9,긴장감있게 잘봤네요 ... 꼬맹이가 연기를 너무잘해서 놀랐어요 ㅋㅋ  
9,결말에 대해 관객들이 좀 더 이해하기 쉽게 표현했으면 좋았을텐데 ㅠ 그래도 리얼 명작☆☆  
9,진짜소름이다 꼭봤으면  
9,완젼 잘 봐씀?혼자서?긴장감이 엄청나네요  
9,15세 맞나요ㅡㅋㅋ 연기력 굿ㅋ  
8,사람의 믿음이라는것 무섭다는걸.보여주는영화넹?  
9,재밌었어요~~~굿잡  
9,숨막힘..흥미진진 약간 열린 결말...?..  
9,2시간 40분이 너무 빨리 지나 감~~  
5,연가자들의 연기는 볼만하나 내용을 이해하기는 좀 어려움. 다본후 이건뭐지? 라는 의문점이 너무 많이 드네요.  
8,사람은 의심하면 안도ㅐ  
8,"영화와 감독의 의도를 이해한다고 해도, 호불호가 갈릴수 있는 영화라는것도 이해하셔야됩니다. 긴 러닝타임동안 엄청난 긴장감이 이어지는건 확실.  "
2,넘 잼없어요  돈아까워 ㅠㅠ  
3,어린 아역이  연기하기에는  참 힘들었겠다는 생각이 ..  
8,고생한티나는 영화평론가들이 좋아하는 영화같음  
7,찜찜한기분...그래서무슨이야길하고싶은건지잘모르겠어요...  
7,내용이 뒤죽박죽 정리가 안되네요감독은 뭘 말하고 싶었던걸까요영화는 시간가는줄 모르고 봤네요 ㅣ  
5,무서운거보다 깜짝 놀라는게 많고 스토리의 결말이 찜찜하고 무서운거를 중간에 이상하게 끊는 희극적요소가 있어 그리 추천은 안한다  
9,몽롱하다 진짜 집에 가는 길 무섭네용ㅋㅋ  
9,무서워서 별 하나 뺍니다...  
10,두번은 봐야 이해될거같은 영화  
10,3시간 러닝 타임이 안끝나길 바랬음  
10,진짜 얼마나 집중하고 봤는지 어깨가 결릴지경! 끝난줄 알았는데 반전이! 또 끝난줄 알았는데 또 반전이! 배우들 연기 소름돋았음 !  
10,간만에 닭살 돋음을 느끼면서 본 호러물이네요 재밌게 잘봤습니다!  
10,영화가 끝나고 극장을 나설때 더 소름끼치는 영화!!  
7,잘이해안되는부분이 있는데 재밌게는 본거같아요 마지막이 이해가잘안됨  
10,한번보고 두번보고 자꾸만보니 10점  
10,막 찬양할 정도는 아니고 잼있긴함.  시간 금방가고ㅎㅎ  
10,연기매우좋음 생각보다재밌음  
9,이 영화 미쳤다. 10자  
8,소문은 사실! 좀더 미쳤으면 좋겠다는생각은 했지만 정말 재미있게봤습니다  
9,보는 동안 계속해서.귀신에 홀린듯한기분?  
9,재밌다재밌다재밌다재밌다  
10,누구도 믿지마셈 무명 열광  외지인  
7,집중하고 봤지만 끝이...뭐지?라는 말밖에..  
10,대단합니다 대단해요 의심치마세요  
5,내가 생각했던 영화가 아니라서 실망했지만 충격과 공포 만큼은 인정할만하다 지금도 심장이 벌렁벌렁 하니까 근데 다신 안볼끄야ㅠㅠㅠ 반전은 무슨 까놓고 보면 되게 별 것 없는 영화이고 연기는 다들 참 잘한다..  
7,이해가안간다 정말 ㅜㅜ  
5,"결국 주인공이 귀신에게 놀아난 이야기. 미묘하다. 일본인 외지인이 곡성 땅에 온 이유는 중요하지 않지만, 마지막에 주인공이 겪는 상황에서 와 닿는 논리적으로든 장르적으로든 정합성을 찾기 어려웠다. 그냥 어 그랬어? 이런 느낌만 남는다.  "
7,제발 이영화 해석좀 나와줘  
8,청불안되려했나.  수준이 좀 그렇고. 음향이 저화가 안맞는지.  전라도사투리랑 썩여 좀 뭔말인지 이해가 좀.  
9,말로설명할수 없는 생전 첨보는 장르  
7,"초중반까진 코믹,스릴 겹쳐 재밌다 싶었지만 후반부엔 과다설정으로 인한 지루함 때문에 7점!!  "
10,무서워서 계속 눈가리면서 봤어요...  
10,저는 정말 재밌게봤어요호불호가 확실히 갈리겠지만징그러운부분빼면 내용해석하는자체로 정말 흥미로운영화인듯!  
6,결말이 찝찝..하지만 생각할건 많은영화  
1,뭔냐영인지도모르겠고 왜본지도모르겠고 이거보고 여자친구 사겼는데 3잏만에 그냥 헤어짐 진짜노잼  
3,영화표 값이 아까웠습니다.  
10,"연기자들 연기 그리고 처음부터 끝까지 집중하게 만드는 영화...너무 잘 만들었다. 재미있는 미국드라마,영화을 본 듯하다.이게 재미 없다는 사람은 그저그런 항상 똑같은 레파토리의 한국 유치한 드라마나 영화에 심취해 있는 듯.  최고의 영화 굿!!  "
9,여자애  연기 정말 볼만하다  
2,제발 범죄는 공포물이아닌데말이지...  
9,진짜 개쩌는 영화지만 마무리가 극혐수준... ㄹㅇ욕나왔음  
9,처음부터끝까지..초집중하게만듬..소~오~름  
10,미끼를 물 수 밖에 없었다...  
10,두번에 걸쳐 나오는 사진찍는 장면이 넘나 소름끼쳤어... 최근 본 한국영화 중에선 정말 최고의 작품이었다.  
9,한국영화가 이렇게까지 발전햇구나 라는 생각이 들게 한 영화. 하지만 감독이 반전의 트릭으로 내놓은 미끼들이 명확히 회수되지 않아 끝맛이 조금 찜찜한 느낌  
9,재미있네요 보고나서 복선정리 한번더 읽으시면 꿀ㅋ잼ㅋ  
10, 끝날때까지 긴장하면서 봤던 영화  
10,"멘붕에 멘붕, 몰입도 최고  "
6,개봉하기전부터 많은 기대를 안고 나온 영화인데 너무 기대했나봐요ㅠ 전 잘 모르겠네요  
7,영화가 너무 어두워 잘 안보이는 장면이 많음.. 햇빛따윈 사치인건지.. 다시 본다면 모를까 아직 다 이해를 못하겠음.. 몰입은 됐는지 긴시간이라 느끼진 않았네요..  
5,갠적으로 안보았으면좋았을것을ㅠㅠ계속 생각이 나고잠자리도 불편하다그냥 단순한스릴러물인줄 알고봤다가 낭패!!!!감독이 무섭다어떻게 저런 영화를 만들지...  
5,후훔...  결말이나  스토리좀  정리좀....  
10,20세기에서 참여한건 다 이유가 있다.  
7,결말이 아쉽긴  하지만 나홍진 감독의 연출력과 배우들의 연기력은 최고!!  
10,으아 진짜 빅재미입니다 감독님 머리 넘 좋음  
6,안무서울꺼라고 얕봤는데 헐 팝콘통으로 가리면서봤다 결말이찝찝하긴하지만 모 나름 재밌었당 깜짝깜짝놀래고 반전도있고 근데황정민아저씨 넘늦게나옴ㅋㅋ  
10,꿀잼!!!.@.@  
10,오랜만에 재밌는 영화. 명불허전 나감독!  
8,재밌어요 무서워요 그냥그래요  
7,예고는 엄청난 기대감을 가지게 만드는데 실제 영화를 보면 기대에 미치지 못한 느낌이네요 생각도 많이 하게 만들고 중간중간 나오는 요소요소들이 영화의 집중을 흐트러뜨리는 부분도 많아요  
10,괜츈 해요 볼만합다 ㅎㅎㅎ  
10,뻔하지 않은 스토리 잔잔하게 흘러가지만 몰입도도 좋고 끝나고 나서도 계속 생각나게 되네요 굿  
10,개인적으로 재밌었습니다  
10,영화시간이 꽤길지만 한순간도 지루하지않았습니다  
2,태어나서처음평점쓰는데초반너무지루하구끝까지너무재미없다  
10,아역배우분 연기가 무서워....  
10,소름!! 재밌고 무서움 ㅠ  
10,최고임 감독판나옴 또볼거임요  
10,난 진짜 내용결말에 반전까지! 대박!ㅋㅋ재밋엇당ㅎ  
9,생각하게 만드는 공포영화는 오랜만이네요  
7,처음부터 끝까지 긴장을 놓치지 못할만큼 스릴있지만 내용을 이해하기 어려워요  
7,감독의 의도를 쉽게 확인하기 어려웠고 전체 흐름이 산만하게 느껴짐  
2,잔인하게 표현 됌에 비해 전체적 내용은  긴박함과 공포가 부족하다  
10,나홍진감독님 사랑합니다  
10,소오름.!!!!꺅ㅋㅋㅋ찝찝하네요  
10,한국영화증에 이렇게 수작은 정말 오랫만에 봅니다  
10,간만에 좀볼만한영화엿어요  
2,다보고나서 뭐지?이생각듬  
5,그냥 반전을 위한 반전영화... 확실히 공포영화는 아님  
9,"한국적 괴담의 농밀한 공간감 위에서 추격자에서 보여주었던 교차편집의 스릴을 령을 갖고 탄다. 한마디로 무섭다. 동양과 서양의 서로다른 공포감을 묘하게 뒤섞은 새로운 시도로도, 시각적공포를 강요하지 않고 이 런 공포감을 만든것으로도 존중받아야할 영화  "
8,보는내내심장이쫄깃함결말이애매하긴하나충분히이해가능결론은괜찮음  
10,어느순간 하나하나 놓치면 안되는 씬들과 영화의 메세지~감동입니다~  
5,그다지.. 기대이하였어요  
2,솔직히 왜 이영화가 재밌다고 하는지 의문이 드네요..; 많이 기대하고 봐서 그런지 더 실망 했습니다. 그 긴 영화시간동안 뭘 말하려는지도 모르겟네욬ㅋㅋㅋ  
6,너무 관객을 속이려고한것같아서 짜증났음  
10,범인을 스포당하고도 긴장감이 끊이지않던 영화는 이번이 처음이었음  
3,비오는날 보니까 현장감이 더욱살아났지만 반전의 연속이여서 보다가 어이가 없었습니다 악의 영화 집합체라고 볼수있네요  
6,개연성이 없네요. 연기는 좋았습니다.  
9,재밌는데 결말이 비오는날 비다맞고 집가는기분임  
5,스토리 전개가 억지로 흘러간다.무섭게 할려고만 했지 끝나고나서 무슨내용인지잘 모르겠다.  
10,최고최고최고최고최고최고최고최고최고  
10,이 영화를보고 1점을 줄 수 있는 그대들의 베베꼬인 속이 곡성이다  
10,내가 본 한국영화 중에 가장 뛰어난 영화입니다  
4,뭡니까이거~짜증지대로네~수준이 넘 높아서인지 내가 잘못된건지 도무지 이해할수가 없네~이게 어째서 15세이상 관람인지~딸애랑 보기 민망해서리~  
5,편집이많아서 이해하기어려운부분도있음  
5,멘탈..이 안돌아옵니다..  
10,재밋어요 시간가는줄 모르고 봄  
4,보는내내 징그러웠어요 병맛이에요  
9,미스터리한 영화 감독님 짱이십니다  
5,생각 보다재미 없네요. 실망이에요  
10,감독은 미끼를 던졌고 관람객들은 미끼를 물었지  
4,의미없는결말....  
10,모든 연기자들 연기가 소름 돋을 정도로 좋았습니다.  
8,몰입도도 좋고 사투리도 찰지고 영화내의 분위기나 스토리도 좋고 반전도 좋았다. 다만 이게 15금이라는데에 의문이생긴다. 왠만한 멘탈로는 이 영화 못볼듯. 복선이 많아서 다시 한번 보고싶다. 뒤에 쿠키영상으로 조금 해설해주면 좋았을텐데 그게 아쉽다.  
8,빈틈없는 시나리오 쉴틈없이 몰아치는 영화 여운이 많이 남는다  
9,영화보는 내내 내 생각이 감독의 의도를 한번이라도 앞서간적이 없었다.  
6,멀까  영화가  말하고 싶은게정말 알고싶다.감독님 말씀 해주세요  
9,어디로 흘러가는지 모르게 흐르다 마지막에 휘몰아치며 끝난다  
10,저의 심장을 쫄긋쫄깃하게 만든 영화였어요...마지막이 약간 열린결말이라 아쉽지만요...ㅠㅠ참 스릴있고 무섭네요...반전의반전ㅎㅎ  
5,어렸을때   할아버지한테 귀신얘기들은것 같은느낌  
6,호러+스릴러+좀비+코믹  
9,처음부터 끝까지 의심을 가지게 하는 영화  
1,하..곡성 그래요 곡성 그렇죠 곡성..  
8,호불호가 너무 갈려지는 영화라 좀 주저하다 봤는데 결론적으로 그럭저럭 볼만했습니다.다소 이해하기난해한 것도 있지만 이런 장르의 영화가 자꾸만들어져야 발전하지않을까 하는 생각과 배우들의 연기는 정말 훌륭했어요  
3,결말이없어. . 쫌. . 아쉬운듯  
6,끝맺음이.좀흐지부지하게끝났내요.뭔가2편이나올것같은예감이ㅡㅡ결과가.정확하게나오지않아.저에게는.그냥저냥한영화였내요.  
10,영화 구성 분위기 배우들의 연기력까지 어디하나 나무랄곳 없는 영화입니다. 영화를 보는 내내 소름. 영화 관람 후에 다가오는 그동안 영화안에서 나타내던 복선들. 간만에 아주 흥미로운 영화였습니다.!  
10,감독의 연출이 기가 막혀서 별 5개  
7,연출 굿 관객을 몰입하게하는 연쇄 사건들의 범인 색출과정  좋았다. 다만 열린결말이라고 하기엔 숨기려고한듯하나 너무 흑과백이 확실히나타나고 이왕 결말을 그렇게 보여줄거였으면 마자막에 백의 노력과 흑의 속이려는 과정을 자세히 보여주는게 깔끔했을거라 생각  
10,여름에  보면 더좋을듯 연기장난아닌듯너무재미^^  
10,보는내내 너무 긴장하고 봐서 그런지 어깨랑 허리가 쪼그라듬. 취향에 따라 호불호가 갈리겠지만... 우선 한국에서 보지못한 영화임에는 분명!  
10,대박... 주말까지 기다릴 수가 없어서 부득부득 빠르게 본 영화. 그 만큼의 기대 이상. 상상 이상!!! 배우들 연기는 정말 대박... 특히 황정민 아저씨 ㅠㅠㅠ 온몸에 소름!!!  
8,정말 가슴이 콩콩 뛰면서 봤습니다. 무서워서 옆 사람에게 안길 뻔했습니다  
8,반전에 반전...소오름...  
10,연기자들 연기력 대박~~~  
10,최고의영화 정말대박...탄탄한스토리와 연기력으로 승부하는 배우들.가장기억에남는영화네요그리고 네이버이용해서 구매햇는데 편리하고좋네요 앞으로도 네이버로 예매해야겠어요  
8,신경쇠약 걸리는줄 ㅋㅋㅋ  
5,시작은 좋았으나 갈수록 으잉? 하게되는 영화  
9,너무 무서워요 ㄷㄷ ㅜㅜ  
10,아역의 연기가 돋보이고 열린결말 꿀잼  
10,무섭기도 했지만 정말 재밌음  
8,영화의 재미 유무를 떠나서 주변인들한테 추천하고싶어요  
8,몰입감은 있었으나 다본후 찝찝함  
10,런닝타임 내내 절대 긴장을 늦출수 없는 영화  당신이 기독교인 이라면 영화속 상징을 더 잘 이해할수 있을것 같다 관람 후 나홍진감독의 인터뷰를 꼭 챙겨보길 귄합니다  
8,배우들연기가살아있네요  
10,최고의 영화입니다....  
1,억지로 짜맞추려는 전개.. 성경말씀을 거기에 끼워넣으려는 시도는 이런 사류도 아닌 오류영화에 막장을 보여주는듯..  이봐 감독양반~! 영화는 당신 즐길라고 만드는게 아니고 공감하하기위해 만드는거라는거 꼭 되새겼음 좋겠네요  
1,전반적으로 연기자들 각자의 연기력이 뛰어나긴 한데~...배경과 영상에서 질퍽하고 끈적이고 이런 지저분함이 불편함이 있으며 내용의 이해가 어려운 아쉬움이 남습니다~.  
10,범인 알고봤지만 다른반전도있었고 몰입도 최고네요.. 넋놓고 봤습니다 저는 얼마 전에 본 시빌워보다 재밌네용  
5,유머도 있고 잘 만들었다 싶었는데 끝나고보니 아무 내용도없고  마무리도없고  기냥 사람 만 정신없이 죽여대다 삼천포로 빠진영화  
10,이해안간다고하는 사람들은 개빠가다  
10,몰입도 최고 결말은 불진절하지만 집에와서도 진하게여운이 남아있던 영화... 배우들의 명연기가 빛을발한다  
10,무서운거 잘보는사람은 스토리가 눈에 보였을꺼고 못보는사람은 집에도 혼자 못갈 영화 중간중간 깜짝놀라긴했는데 스토리 너무 좋다 반전의묘미  
9,소름돋았다 나에게는 최고의 한국영화로 기억될듯  
5,그냥...그냥그랬다  
5,잔혹한 장면들로 도배된 영화..도대체 무엇을 이야기하고 싶은지..영상해악이 무엇인지를 일깨워주는 반면교사적인 영화..  
8,관람 후 퍼즐이 맞춰지면서 더 놀라게되는 영화입니다 ㅎㅎ  
10,개 무섭네요아직도 무서워서 지금 집못들어가고있음요  
10,재미도있고 적당히 무섭고 미스테리한 반전도있고 한국에서 이런영화가 만들어졌다는게 믿기지않네  
5,"당위성이나 복선도 없어서 황망하고, 악마의 눈은 유치하기까지합니다. 배우분들 연기력이 좋고 긴 시간이 지루하진 않습니다.  "
2,개무섭다 너무무서웠다  좀 잘놀래는분이랑 꿈잘꾸는분 비추  
10,한국 공포영화의 부흥이 시작될거같은 공포물  
8,무삭제판 나오면 또 보러가야지ㅎㅎ  
2,찝찝함의.극치황정민 곽도원 쿠니무라 준의 연기는 볼만함잔뜩 펼쳐놓고 무책임하게 대강 봉합.  
8,  호불호가 많이 갈리는영화라지만 2시간넘는시간을 시간가는줄 모르고 봤네요~ 저는 재미있게 봤습니다^^  
5,두번 보고 싶지는 않은 영화  
5,먼가모르게허무함ㅋㅋ  
2,뭥미 ...ㅋㅋㅋ뭘 말하고자 하는지...  
10,긴장감 넘치고 알면알수록 그냥만든 영화가 아닙니다!  
10,굿!!좋았습니다~ㅎㅎ  
2,낚인거같음 보는 내내 심기가 불편했고. 마지막이 더 짜증났음. 미스테리한건 알지만 결과가 모호함. 정말 추천하고싶지않음. 추천안함  . 황정민 넘 좋아하는데 실망 ㅠㅠ  
1,막막 재밌게 봤다 볼때만 전무후무한 반전이 아닐까 그 반전 하나때문에 쭉 재밋게 봤는데 한순간에 재미없는 영화로 만들어버렸다 이영화를 볼거면 마지막 부분은 안보는걸 추천한다 그러면 재밋는 영화가 될것이다  
10,"쫄깃쫄깃합니다,,,,  "
6,스토리가 뭔가 짜집기한듯한 느낌을받았고 무섭기도 했지만 이상했음  
9,이런 영화는 처음이다 결말을 보고도 재미가 있었음  
9,호불호가 갈리는듯 하지만 재미있었습니다  
6,시간가는줄모르고봤긴한데... 내용이 도무지 이해가가지않는영화였음  
8,생각보다는..별로였어  
10,정말 재밌다....죽기전에 한국에서 이런 영화가 나올까?  
10,혼자보고 후회했던영화.. 꼭 옆에 누구데리고가서보세요 지금도 손떨림...반전대박!  
7,중간까지는볼만했으나..후반부로갈수록전개가뒤죽박죽이고 마무리는ㅋㅋㅋㅋ  
10,볼때는 충격이고 끝나고 난 후엔 계속된 생각이 꼬리를 뭅니다..뭔가 반성도 하게 되는..그래서 다시보러갑니다  
10,영화내용 이해안간다는 사람들 뭐지? 몰입 내용 연기 깊이 완벽한데 ㅋ  
7,"나홍진 전작들에 비해 부족하다. 긴 러닝타임을 몰입감있게 만든 것은 박수보내고 싶지만. 추격자, 황해는 여러번 봤었는데...곡성은 한번으로 끝일것같다. 배우들의 연기에 박수를 보내고싶다.  "
10,감독이고배우고 넘나 잘한다...  
5,재미집니다한번보십쇼  
10,굿굿 잼남 근대 어려워요 ㅎㅎㅎ 결말이 뭔지 아직 생각중 ㅎㅎ  
10,스토리가 좀 어려웠지만 진짜 재밌었습니다!반전이 소름 돋네요ㅎㅎ  
10,완전소름  배우들연기  몰입도 500프로 눈한번 깜짝일수없을정도  ?공포의 잔상이  너무오래 남을듯이제것  우리나라에   없던  새로운형태  공포영화무지 재미나지만  혼자보지는말것  
1,보고나면 그냠찜찜 한 그런영화  
1,진짜무서워서 오금이저림  
2,"난 도대체 이 영화가 왜들 그렇게 호평을 주는지 모르겠다 친절하지 않은 내용생략과 억지스러운 끼워맞춤에 열린 결말는 개뿔 황당하기 짝이 없는 엔딩, 영화 끝나자마자 사람들 다 어이없어하면서 나감. 완전 기분 더러운 영화임 돈 주고 스트레스 삼  "
10,올해 최고의 영화입니다!  
10,나홍진감독은 미친사람입니다.  
5,이해가 안되고 딱히 재미까지도...  
10,오랜만에 볼만한 한국영화  
3,보고나니까 밥이 안 맥힌다  
1,보다가 지루해서 한시간남기고나옴모임 공포면 공포답게 스릴러면 스릴러답게 코미디스럽게섞은거같아즐  
3,"도대체 뭔 얘긴 지,  영화를 본 관객한테 ""최소한""의 알 권리는 좀 줘야되는 거 아닌가?살인의 원인, 무당과 일본놈과의 관계,어설픈 사투리 쓰는 천우희의 역할  등이 중 하나라도....아, 짜증.  "
1,뭔내용인지 1도 이해안되네요  
1,너무 찝찝해ㅡㅡ 10자  
1,뭔데 이거!10자제한  
1,도데체 이영화가  왜 재미있는건지  모르것네요.결론도 이해가안가고  끝나고나서   뭐지?라는생각뿐.잔인하고 호러스런 분위기가 끝까지가는영화.재미있는영화를 찾으신다면 다른걸보세요!  
9,진짜 너무 재밌게봤어요 한번 더 볼 예정  
2,허세좋아하는 김치나라에서 좋아할 법한 영화  
7,"영국 현지에서 맨유 경기를 보러갔는데,골을 못넣는 기분.  "
10,긴 상영시간이 길다고 느껴지지않을 만큼 재밋음  
6,기대보단 ..못했습니다..  
10,동양의 관점으로 풀어낸천사와 악마의 싸움... 반전의 반전이 넘친다  
10,내스타일 영화에요 재밋어오  
10,어째서 20세기폭스사가 이 영화에 투자하고 배급까지 맡았는지 답이 나온다  
10,지립니다현혹 되엇습니다 ㅜ  
10,나홍진 감독의 영화에 곡성만 남을만큼의 인상!  
10,최고였습니다 몰입도 스토리 훌륭한영화입니다  
10,졸잼 말그대로 잼씀 꼭 봐야함  
9,등에 땀 났다.. 천우희 팬 됐음  
10,넘 연기도 좋았고 보는내내 소름..오랜만에 영화같은영화 봤습니다  
4,감독의 고향도 곡성.. 일본 배우를 떄려잡으러 가는 장면에서 트럭타고 연장챙기고 가는 부분을 보고 그 지역의 수준을 또 실감함  
1,세상 재미없었어요.게다가 너무지루  
1,쏘쏘 시간 돈낭비 기대하고 봐서 그런가?  
1,진짜....기분찝찝하게만드는 영화ㅠ왜 돈주고 이걸봤지ㅡㅡ  1점도아깝다ㅠ진짜...  
